,sentence,meta,max_match_extracted,y_true
115,"i love all of the features , and presets as well .",{'feature': 'positive'},set(),"[0, 0, 0, 0, 0, 0, 0, 0, 0, 0, 0, 0, 0, 0, 0, 0, 0, 0, 0, 0, 0, 0, 0, 0, 0, 0, 0, 0, 0, 0, 0]"
116,"sunset feature takes incredible pics in the morning , and the evening !",{'sunset feature': 'positive'},"{('sunset feature', 'positive')}","[0, 1, 0, 0, 0, 0, 0, 0, 0, 0, 0, 0, 0, 0, 0, 0, 0, 0, 0, 0, 0, 0, 0, 0, 0, 0, 0, 0, 0, 0, 0]"
117,the software you get with this camera is perfect .,{'software': 'positive'},set(),"[0, 0, 0, 0, 0, 0, 0, 0, 0, 0, 0, 0, 0, 0, 0, 0, 0, 0, 0, 0, 0, 0, 0, 0, 0, 0, 0, 0, 0, 0, 0]"
118,"touchups , redeye , and so on are very easy to alter , and correct .","{'redeye': 'positive', 'touchup': 'positive'}",set(),"[0, 0, 0, 0, 0, 0, 0, 0, 0, 0, 0, 0, 0, 0, 0, 0, 0, 0, 0, 0, 0, 0, 0, 0, 0, 0, 0, 0, 0, 0, 0]"
119,i definately recommend a large memory card .,{},set(),"[0, 0, 0, 0, 0, 0, 0, 0, 0, 0, 0, 0, 0, 0, 0, 0, 0, 0, 0, 0, 0, 0, 0, 0, 0, 0, 0, 0, 0, 0, 0]"
120,"i use a 128mb card , and usually get around 70 to 100 pics 1024-1280 res. , with good resolution .",{},set(),"[0, 0, 0, 0, 0, 0, 0, 0, 0, 0, 0, 0, 0, 0, 0, 0, 0, 0, 0, 0, 0, 0, 0, 0, 0, 0, 0, 0, 0, 0, 0]"
121,very large pics take 8mb each !,{},set(),"[0, 0, 0, 0, 0, 0, 0, 0, 0, 0, 0, 0, 0, 0, 0, 0, 0, 0, 0, 0, 0, 0, 0, 0, 0, 0, 0, 0, 0, 0, 0]"
122,"battery life is good , although i recommend two rechargebles , or a alkaline backup , for those emergency pics you have to have .",{'battery life': 'positive'},"{('battery life', 'positive')}","[0, 1, 0, 0, 0, 0, 0, 0, 0, 0, 0, 0, 0, 0, 0, 0, 0, 0, 0, 0, 0, 0, 0, 0, 0, 0, 0, 0, 0, 0, 0]"
123,"all and all , i am extremely pleased with this camera .",{'camera': 'positive'},"{('camera', 'positive')}","[0, 0, 0, 0, 0, 0, 0, 0, 0, 1, 0, 0, 0, 0, 0, 0, 0, 0, 0, 0, 0, 0, 0, 0, 0, 0, 0, 0, 0, 0, 0]"
124,making the step from film to digital has been a great move .,{},set(),"[0, 0, 0, 0, 0, 0, 0, 0, 0, 0, 0, 0, 0, 0, 0, 0, 0, 0, 0, 0, 0, 0, 0, 0, 0, 0, 0, 0, 0, 0, 0]"
125,i find myself emailing pics to everyone i know .,{},set(),"[0, 0, 0, 0, 0, 0, 0, 0, 0, 0, 0, 0, 0, 0, 0, 0, 0, 0, 0, 0, 0, 0, 0, 0, 0, 0, 0, 0, 0, 0, 0]"
126,"great camera , great investment !",{'camera': 'positive'},"{('camera', 'positive')}","[0, 1, 0, 0, 0, 0, 0, 0, 0, 0, 0, 0, 0, 0, 0, 0, 0, 0, 0, 0, 0, 0, 0, 0, 0, 0, 0, 0, 0, 0, 0]"
127,"this is my second digital camera , though i also use one at work and have some experience with several nikon and canon models .",{},set(),"[0, 0, 0, 0, 0, 0, 0, 0, 0, 0, 0, 0, 0, 0, 0, 0, 0, 0, 0, 0, 0, 0, 0, 0, 0, 0, 0, 0, 0, 0, 0]"
128,with an extra battery and a couple of good sized memory cards you are all set for a day of picture taking while on vacation .,{},set(),"[0, 0, 0, 0, 0, 0, 0, 0, 0, 0, 0, 0, 0, 0, 0, 0, 0, 0, 0, 0, 0, 0, 0, 0, 0, 0, 0, 0, 0, 0, 0]"
129,the auto setting does a great job most of the time but there are manual settings for those who want them .,{'auto setting': 'positive'},"{('auto setting', 'positive')}","[0, 0, 0, 0, 0, 0, 0, 0, 0, 0, 0, 0, 0, 0, 0, 0, 0, 0, 0, 0, 1, 0, 0, 0, 0, 0, 0, 0, 0, 0, 0]"
130,"if something were to happen to my nikon coolpix 4300 , i would order another just like it .",{},set(),"[0, 0, 0, 0, 0, 0, 0, 0, 0, 0, 0, 0, 0, 0, 0, 0, 0, 0, 0, 0, 0, 0, 0, 0, 0, 0, 0, 0, 0, 0, 0]"
131,after much research i decided on the nikon coolpix 4300 .,{},set(),"[0, 0, 0, 0, 0, 0, 0, 0, 0, 0, 0, 0, 0, 0, 0, 0, 0, 0, 0, 0, 0, 0, 0, 0, 0, 0, 0, 0, 0, 0, 0]"
132,"it takes excellent pics and is very easy to use , if you read the manual .","{'picture': 'positive', 'ease of use': 'positive'}",set(),"[0, 0, 0, 0, 0, 0, 0, 0, 0, 0, 0, 0, 0, 0, 0, 0, 0, 0, 0, 0, 0, 0, 0, 0, 0, 0, 0, 0, 0, 0, 0]"
133,if you cant get great pics from this camera its because you havent read the manual .,{},set(),"[0, 0, 0, 0, 0, 0, 0, 0, 0, 0, 0, 0, 0, 0, 0, 0, 0, 0, 0, 0, 0, 0, 0, 0, 0, 0, 0, 0, 0, 0, 0]"
134,the only things i have found that i havent liked is that the lcd is hard to read in daylight but everyone elses is too .,{'lcd': 'negative'},"{('things', 'positive'), ('lcd', 'negative')}","[0, 0, 0, 0, 0, 0, 0, 0, 0, 0, 0, 0, 0, 0, 0, 0, 0, 0, 0, 0, 1, 0, 0, 0, 0, 0, 0, 0, 0, 0, 0]"
135,downloads are a snap and quick .,{'download': 'positive'},set(),"[0, 0, 0, 0, 0, 0, 0, 0, 0, 0, 0, 0, 0, 0, 0, 0, 0, 0, 0, 0, 0, 0, 0, 0, 0, 0, 0, 0, 0, 0, 0]"
136,controls easy yo use and easy to get to .,{'control': 'positive'},set(),"[0, 0, 0, 0, 0, 0, 0, 0, 0, 0, 0, 0, 0, 0, 0, 0, 0, 0, 0, 0, 0, 0, 0, 0, 0, 0, 0, 0, 0, 0, 0]"
137,i 'm extremely glad i bought this camera .,{'camera': 'positive'},"{('camera', 'positive')}","[0, 0, 0, 0, 1, 0, 0, 0, 0, 0, 0, 0, 0, 0, 0, 0, 0, 0, 0, 0, 0, 0, 0, 0, 0, 0, 0, 0, 0, 0, 0]"
138,really happy with this little camera .,{'camera': 'positive'},set(),"[0, 0, 0, 0, 0, 0, 0, 0, 0, 0, 0, 0, 0, 0, 0, 0, 0, 0, 0, 0, 0, 0, 0, 0, 0, 0, 0, 0, 0, 0, 0]"
139,"got it for christmas , still learning a few of the settings , but i do n't take pictures every single day .",{},set(),"[0, 0, 0, 0, 0, 0, 0, 0, 0, 0, 0, 0, 0, 0, 0, 0, 0, 0, 0, 0, 0, 0, 0, 0, 0, 0, 0, 0, 0, 0, 0]"
140,"settings for just about everything , beautiful pics and beautiful prints .","{'picture': 'positive', 'print': 'positive'}",set(),"[0, 0, 0, 0, 0, 0, 0, 0, 0, 0, 0, 0, 0, 0, 0, 0, 0, 0, 0, 0, 0, 0, 0, 0, 0, 0, 0, 0, 0, 0, 0]"
141,"i expected the 12x digital zoom to be grainy , but onfull size high to fine quality , the zoomed images are quite impressive .",{'zoomed image': 'positive'},set(),"[0, 0, 0, 0, 0, 0, 0, 0, 0, 0, 0, 0, 0, 0, 0, 0, 0, 0, 0, 0, 0, 0, 0, 0, 0, 0, 0, 0, 0, 0, 0]"
142,"did buy a 256mb compact flash , it holds a lot of pics at any resolution .",{},set(),"[0, 0, 0, 0, 0, 0, 0, 0, 0, 0, 0, 0, 0, 0, 0, 0, 0, 0, 0, 0, 0, 0, 0, 0, 0, 0, 0, 0, 0, 0, 0]"
143,"i only wish you could get high quality tiff images at all resolutions , but does n't seem any of the buget cameras do .",{},set(),"[0, 0, 0, 0, 0, 0, 0, 0, 0, 0, 0, 0, 0, 0, 0, 0, 0, 0, 0, 0, 0, 0, 0, 0, 0, 0, 0, 0, 0, 0, 0]"
144,"still , at least from my perspective , a great camera for the money , and i 'm a happy camper !",{'camera': 'positive'},"{('camera', 'positive')}","[0, 0, 0, 0, 0, 0, 0, 0, 0, 0, 1, 0, 0, 0, 0, 0, 0, 0, 0, 0, 0, 0, 0, 0, 0, 0, 0, 0, 0, 0, 0]"
145,this is a wonderful camera .,{'camera': 'positive'},"{('camera', 'positive')}","[0, 0, 0, 1, 0, 0, 0, 0, 0, 0, 0, 0, 0, 0, 0, 0, 0, 0, 0, 0, 0, 0, 0, 0, 0, 0, 0, 0, 0, 0, 0]"
146,my wife and i read and read and read reviews on different cameras for months .,{},set(),"[0, 0, 0, 0, 0, 0, 0, 0, 0, 0, 0, 0, 0, 0, 0, 0, 0, 0, 0, 0, 0, 0, 0, 0, 0, 0, 0, 0, 0, 0, 0]"
147,in the end this is the one that we decided upon and since have never had buyer 's remorse .,{},set(),"[0, 0, 0, 0, 0, 0, 0, 0, 0, 0, 0, 0, 0, 0, 0, 0, 0, 0, 0, 0, 0, 0, 0, 0, 0, 0, 0, 0, 0, 0, 0]"
148,"4 mp gives you room for the future gaining experience ; cost offsets over time from wanting more in a camera , 3x optical and the fact that it carries nikon 's quality reputation behind it make the whole package prove itself worthwile at the price .","{'mp': 'positive', 'optical zoom': 'positive'}","{('mp', 'positive'), ('whole package', 'positive')}","[0, 1, 0, 0, 0, 0, 0, 0, 0, 0, 0, 0, 0, 0, 0, 0, 0, 0, 0, 0, 0, 0, 0, 0, 0, 0, 0, 0, 0, 0, 0]"
149,one neat thing - i have taken some pictures in what i thought would be impossible lighting conditions pitch black rooms - no problem for the camera - rooms looked like they had ample lighting .,{'picture': 'positive'},set(),"[0, 0, 0, 0, 0, 0, 0, 0, 0, 0, 0, 0, 0, 0, 0, 0, 0, 0, 0, 0, 0, 0, 0, 0, 0, 0, 0, 0, 0, 0, 0]"
150,this little camera has created a marriage between myself and nikon. never knew i could love a digital camera so much .,{'camera': 'positive'},"{('camera', 'positive')}","[0, 0, 0, 0, 0, 0, 0, 0, 0, 0, 0, 0, 0, 0, 0, 0, 0, 0, 0, 0, 0, 0, 0, 0, 0, 0, 0, 0, 0, 1, 0]"
151,the software that comes with it is amazing and the online service that comes free is really very neat. clean clear and well focused on over 95 % of all photos taken by a beginner .,"{'software': 'positive', 'online service': 'positive'}","{('software', 'positive'), ('online service', 'positive')}","[0, 0, 1, 0, 0, 0, 0, 1, 0, 0, 0, 0, 0, 0, 0, 0, 0, 0, 0, 0, 0, 0, 0, 0, 0, 0, 0, 0, 0, 0, 0]"
152,100 % perfect if you put some thought and time into reading the manual before you take the photos .,{},set(),"[0, 0, 0, 0, 0, 0, 0, 0, 0, 0, 0, 0, 0, 0, 0, 0, 0, 0, 0, 0, 0, 0, 0, 0, 0, 0, 0, 0, 0, 0, 0]"
153,i took the camera and just gave it to someone .,{},set(),"[0, 0, 0, 0, 0, 0, 0, 0, 0, 0, 0, 0, 0, 0, 0, 0, 0, 0, 0, 0, 0, 0, 0, 0, 0, 0, 0, 0, 0, 0, 0]"
154,no instructions .,{},set(),"[0, 0, 0, 0, 0, 0, 0, 0, 0, 0, 0, 0, 0, 0, 0, 0, 0, 0, 0, 0, 0, 0, 0, 0, 0, 0, 0, 0, 0, 0, 0]"
155,just point and shoot and the photos were great .,{'photo': 'positive'},set(),"[0, 0, 0, 0, 0, 0, 0, 0, 0, 0, 0, 0, 0, 0, 0, 0, 0, 0, 0, 0, 0, 0, 0, 0, 0, 0, 0, 0, 0, 0, 0]"
156,just imagine if you place a bit of knowledge when you take your photos .,{},set(),"[0, 0, 0, 0, 0, 0, 0, 0, 0, 0, 0, 0, 0, 0, 0, 0, 0, 0, 0, 0, 0, 0, 0, 0, 0, 0, 0, 0, 0, 0, 0]"
157,the memory card fit nicely since i also have a pocket pc and it automatically installed a picture software on my pda wolla .,{'memory card': 'positive'},set(),"[0, 0, 0, 0, 0, 0, 0, 0, 0, 0, 0, 0, 0, 0, 0, 0, 0, 0, 0, 0, 0, 0, 0, 0, 0, 0, 0, 0, 0, 0, 0]"
158,my pda becames a digital album .,{},set(),"[0, 0, 0, 0, 0, 0, 0, 0, 0, 0, 0, 0, 0, 0, 0, 0, 0, 0, 0, 0, 0, 0, 0, 0, 0, 0, 0, 0, 0, 0, 0]"
159,i have a 128mb card in it and can shoot over 150 hi res photos .,{},set(),"[0, 0, 0, 0, 0, 0, 0, 0, 0, 0, 0, 0, 0, 0, 0, 0, 0, 0, 0, 0, 0, 0, 0, 0, 0, 0, 0, 0, 0, 0, 0]"
160,"if you have to buy a camera on a buget, this has got to be the one .",{'camera': 'positive'},"{('camera', 'positive')}","[0, 0, 0, 0, 0, 0, 0, 0, 0, 0, 1, 0, 0, 0, 0, 0, 0, 0, 0, 0, 0, 0, 0, 0, 0, 0, 0, 0, 0, 0, 0]"
161,go get it .,{},set(),"[0, 0, 0, 0, 0, 0, 0, 0, 0, 0, 0, 0, 0, 0, 0, 0, 0, 0, 0, 0, 0, 0, 0, 0, 0, 0, 0, 0, 0, 0, 0]"
162,before they are sold out !,{},set(),"[0, 0, 0, 0, 0, 0, 0, 0, 0, 0, 0, 0, 0, 0, 0, 0, 0, 0, 0, 0, 0, 0, 0, 0, 0, 0, 0, 0, 0, 0, 0]"
163,"great camera , i have been using this for several months and got excellent results , simple friendly usage , in many scenes indoor , outdoor , snow , close up macro etc.",{'camera': 'positive'},"{('camera', 'positive'), ('many scenes indoor', 'positive'), ('results', 'positive'), ('several months', 'negative')}","[0, 1, 0, 0, 0, 0, 0, 0, 0, 0, 0, 0, 0, 0, 0, 0, 0, 0, 0, 0, 0, 0, 0, 0, 0, 0, 0, 0, 0, 0, 0]"
164,i bought my nikon coolpix4300 about a week ago .,{},set(),"[0, 0, 0, 0, 0, 0, 0, 0, 0, 0, 0, 0, 0, 0, 0, 0, 0, 0, 0, 0, 0, 0, 0, 0, 0, 0, 0, 0, 0, 0, 0]"
165,this is my first digital camera and i can say that i am quite impressed with the features that it has .,"{'camera': 'positive', 'feature': 'positive'}","{('camera', 'positive')}","[0, 0, 0, 1, 0, 0, 0, 0, 0, 0, 0, 0, 0, 0, 0, 0, 0, 0, 0, 0, 0, 0, 0, 0, 0, 0, 0, 0, 0, 0, 0]"
166,i particularly like the way it aids me in taking my macro shots .,{'macro': 'positive'},set(),"[0, 0, 0, 0, 0, 0, 0, 0, 0, 0, 0, 0, 0, 0, 0, 0, 0, 0, 0, 0, 0, 0, 0, 0, 0, 0, 0, 0, 0, 0, 0]"
167,my friends were impressed with the quality of the pictures i took !,{'picture quality': 'positive'},set(),"[0, 0, 0, 0, 0, 0, 0, 0, 0, 0, 0, 0, 0, 0, 0, 0, 0, 0, 0, 0, 0, 0, 0, 0, 0, 0, 0, 0, 0, 0, 0]"
168,one downside though is that autofocus does not work well when battery is low .,{'autofocus': 'negative'},"{('battery', 'positive'), ('downside though', 'positive'), ('autofocus', 'negative')}","[0, 1, 0, 0, 0, 0, 0, 0, 0, 0, 0, 0, 0, 0, 0, 0, 0, 0, 0, 0, 0, 0, 0, 0, 0, 0, 0, 0, 0, 0, 0]"
169,i assume this is the case for most cameras since it does not have enough power to do autofocus .,{},set(),"[0, 0, 0, 0, 0, 0, 0, 0, 0, 0, 0, 0, 0, 0, 0, 0, 0, 0, 0, 0, 0, 0, 0, 0, 0, 0, 0, 0, 0, 0, 0]"
170,battery life is ok .,{'battery life': 'positive'},"{('battery life', 'positive')}","[0, 1, 0, 0, 0, 0, 0, 0, 0, 0, 0, 0, 0, 0, 0, 0, 0, 0, 0, 0, 0, 0, 0, 0, 0, 0, 0, 0, 0, 0, 0]"
171,i plan on buying a second battery and a larger cf for it .,{},set(),"[0, 0, 0, 0, 0, 0, 0, 0, 0, 0, 0, 0, 0, 0, 0, 0, 0, 0, 0, 0, 0, 0, 0, 0, 0, 0, 0, 0, 0, 0, 0]"
172,"great camera , and for the price you can 't beat it .",{'camera': 'positive'},"{('camera', 'positive')}","[0, 0, 0, 1, 0, 0, 0, 0, 0, 0, 0, 0, 0, 0, 0, 0, 0, 0, 0, 0, 0, 0, 0, 0, 0, 0, 0, 0, 0, 0, 0]"
173,i 've been using it for about 3 months now .,{},set(),"[0, 0, 0, 0, 0, 0, 0, 0, 0, 0, 0, 0, 0, 0, 0, 0, 0, 0, 0, 0, 0, 0, 0, 0, 0, 0, 0, 0, 0, 0, 0]"
174,i found the controls very intuitive and learned how to manuver through the menus quickly .,{'control': 'positive'},set(),"[0, 0, 0, 0, 0, 0, 0, 0, 0, 0, 0, 0, 0, 0, 0, 0, 0, 0, 0, 0, 0, 0, 0, 0, 0, 0, 0, 0, 0, 0, 0]"
175,the quality is superb .,{'quality': 'positive'},set(),"[0, 0, 0, 0, 0, 0, 0, 0, 0, 0, 0, 0, 0, 0, 0, 0, 0, 0, 0, 0, 0, 0, 0, 0, 0, 0, 0, 0, 0, 0, 0]"
176,"the small size is perfect for my little hands , but may perhaps be uncomfortable or awkward for a bigger person .",{'size': 'positive'},set(),"[0, 0, 0, 0, 0, 0, 0, 0, 0, 0, 0, 0, 0, 0, 0, 0, 0, 0, 0, 0, 0, 0, 0, 0, 0, 0, 0, 0, 0, 0, 0]"
177,"we use older versions 880 , 885 of this model in the office and i find them to produce excellent quality photos .",{},set(),"[0, 0, 0, 0, 0, 0, 0, 0, 0, 0, 0, 0, 0, 0, 0, 0, 0, 0, 0, 0, 0, 0, 0, 0, 0, 0, 0, 0, 0, 0, 0]"
178,"the 4300 is a very durable , compact package , and i find nikon to be a brand that i can trust .",{'nikon': 'positive'},set(),"[0, 0, 0, 0, 0, 0, 0, 0, 0, 0, 0, 0, 0, 0, 0, 0, 0, 0, 0, 0, 0, 0, 0, 0, 0, 0, 0, 0, 0, 0, 0]"
179,it comes with a 16mb flash card that you will need to upgrade !,{},set(),"[0, 0, 0, 0, 0, 0, 0, 0, 0, 0, 0, 0, 0, 0, 0, 0, 0, 0, 0, 0, 0, 0, 0, 0, 0, 0, 0, 0, 0, 0, 0]"
180,"we got a 256mb card , and have been hard-pressed to fill it over a weekend .",{},set(),"[0, 0, 0, 0, 0, 0, 0, 0, 0, 0, 0, 0, 0, 0, 0, 0, 0, 0, 0, 0, 0, 0, 0, 0, 0, 0, 0, 0, 0, 0, 0]"
181,the only drawbacks that i have noticed :,{},set(),"[0, 0, 0, 0, 0, 0, 0, 0, 0, 0, 0, 0, 0, 0, 0, 0, 0, 0, 0, 0, 0, 0, 0, 0, 0, 0, 0, 0, 0, 0, 0]"
182,"it comes with a rechargable battery that does not seem to last all that long , especially if you use the flash a lot .",{'battery': 'negative'},set(),"[0, 0, 0, 0, 0, 0, 0, 0, 0, 0, 0, 0, 0, 0, 0, 0, 0, 0, 0, 0, 0, 0, 0, 0, 0, 0, 0, 0, 0, 0, 0]"
183,"so , it 's a good idea to purchase an extra battery to insure that you are not left hanging .",{},set(),"[0, 0, 0, 0, 0, 0, 0, 0, 0, 0, 0, 0, 0, 0, 0, 0, 0, 0, 0, 0, 0, 0, 0, 0, 0, 0, 0, 0, 0, 0, 0]"
184,it does not have an auto-focus assist light which is nice for taking shots in low-light situations it allows the camera to focus in low light .,{'autofocus assist light': 'negative'},set(),"[0, 0, 0, 0, 0, 0, 0, 0, 0, 0, 0, 0, 0, 0, 0, 0, 0, 0, 0, 0, 0, 0, 0, 0, 0, 0, 0, 0, 0, 0, 0]"
185,"i would say that this is not a major issue , but it can be slightly annoying if you care about these things .",{},set(),"[0, 0, 0, 0, 0, 0, 0, 0, 0, 0, 0, 0, 0, 0, 0, 0, 0, 0, 0, 0, 0, 0, 0, 0, 0, 0, 0, 0, 0, 0, 0]"
186,"it has a 3x optical zoom , which is average for these cameras .",{'optical zoom': 'negative'},set(),"[0, 0, 0, 0, 0, 0, 0, 0, 0, 0, 0, 0, 0, 0, 0, 0, 0, 0, 0, 0, 0, 0, 0, 0, 0, 0, 0, 0, 0, 0, 0]"
187,"for more , you sacrifice weight and size : more optical zoom requires more glass and focal length .",{},set(),"[0, 0, 0, 0, 0, 0, 0, 0, 0, 0, 0, 0, 0, 0, 0, 0, 0, 0, 0, 0, 0, 0, 0, 0, 0, 0, 0, 0, 0, 0, 0]"
188,"it does have a digital zoom on top of the optical zoom , but you sacrifice quality .",{},set(),"[0, 0, 0, 0, 0, 0, 0, 0, 0, 0, 0, 0, 0, 0, 0, 0, 0, 0, 0, 0, 0, 0, 0, 0, 0, 0, 0, 0, 0, 0, 0]"
189,"i set the camera to the "" manual "" mode for one main reason :",{},set(),"[0, 0, 0, 0, 0, 0, 0, 0, 0, 0, 0, 0, 0, 0, 0, 0, 0, 0, 0, 0, 0, 0, 0, 0, 0, 0, 0, 0, 0, 0, 0]"
190,in any other mode it autofocuses continuously and burns batteries .,{},set(),"[0, 0, 0, 0, 0, 0, 0, 0, 0, 0, 0, 0, 0, 0, 0, 0, 0, 0, 0, 0, 0, 0, 0, 0, 0, 0, 0, 0, 0, 0, 0]"
191,"in manual , you can set it to "" single af "" where it will focus by depressing the shudder button prior to taking the pic ; this is not really a hinderance , you just have to be familiar with its menus and features .",{},set(),"[0, 0, 0, 0, 0, 0, 0, 0, 0, 0, 0, 0, 0, 0, 0, 0, 0, 0, 0, 0, 0, 0, 0, 0, 0, 0, 0, 0, 0, 0, 0]"
192,"in reality , these are the only drawbacks this camera has , much less than many other models !",{},set(),"[0, 0, 0, 0, 0, 0, 0, 0, 0, 0, 0, 0, 0, 0, 0, 0, 0, 0, 0, 0, 0, 0, 0, 0, 0, 0, 0, 0, 0, 0, 0]"
193,"it is easy to "" focus "" in on the drawbacks , so do n't think i hate this camera .",{},set(),"[0, 0, 0, 0, 0, 0, 0, 0, 0, 0, 0, 0, 0, 0, 0, 0, 0, 0, 0, 0, 0, 0, 0, 0, 0, 0, 0, 0, 0, 0, 0]"
194,it really is an awesome camera that is hard to beat for general-to moderate snapping .,{'camera': 'positive'},"{('camera', 'positive')}","[0, 1, 0, 0, 0, 0, 0, 0, 0, 0, 0, 0, 0, 0, 0, 0, 0, 0, 0, 0, 0, 0, 0, 0, 0, 0, 0, 0, 0, 0, 0]"
195,"for work , we use them in the field often , and they hold up really well .",{},set(),"[0, 0, 0, 0, 0, 0, 0, 0, 0, 0, 0, 0, 0, 0, 0, 0, 0, 0, 0, 0, 0, 0, 0, 0, 0, 0, 0, 0, 0, 0, 0]"
196,they take excellent macro shots as well .,{'macro': 'positive'},set(),"[0, 0, 0, 0, 0, 0, 0, 0, 0, 0, 0, 0, 0, 0, 0, 0, 0, 0, 0, 0, 0, 0, 0, 0, 0, 0, 0, 0, 0, 0, 0]"
197,"the menus and features are easy to manipulate and access , and it takes silent movies .",{'menu': 'positive'},set(),"[0, 0, 0, 0, 0, 0, 0, 0, 0, 0, 0, 0, 0, 0, 0, 0, 0, 0, 0, 0, 0, 0, 0, 0, 0, 0, 0, 0, 0, 0, 0]"
198,"i compared this to a lot of other cameras , believe me , it 's value for money .",{'camera': 'positive'},set(),"[0, 0, 0, 0, 0, 0, 0, 0, 0, 0, 0, 0, 0, 0, 0, 0, 0, 0, 0, 0, 0, 0, 0, 0, 0, 0, 0, 0, 0, 0, 0]"
199,the picturers are amazing .,{'picture': 'positive'},set(),"[0, 0, 0, 0, 0, 0, 0, 0, 0, 0, 0, 0, 0, 0, 0, 0, 0, 0, 0, 0, 0, 0, 0, 0, 0, 0, 0, 0, 0, 0, 0]"
200,"do n't waste time looking at anything else , just buy this one .",{},set(),"[0, 0, 0, 0, 0, 0, 0, 0, 0, 0, 0, 0, 0, 0, 0, 0, 0, 0, 0, 0, 0, 0, 0, 0, 0, 0, 0, 0, 0, 0, 0]"
201,it do n't get any better then the nikon 4300 .,{},set(),"[0, 0, 0, 0, 0, 0, 0, 0, 0, 0, 0, 0, 0, 0, 0, 0, 0, 0, 0, 0, 0, 0, 0, 0, 0, 0, 0, 0, 0, 0, 0]"
202,"i am a nikon fan , and owned and used slr nikon fe , n50 and n90s for many many years .",{},set(),"[0, 0, 0, 0, 0, 0, 0, 0, 0, 0, 0, 0, 0, 0, 0, 0, 0, 0, 0, 0, 0, 0, 0, 0, 0, 0, 0, 0, 0, 0, 0]"
203,"recently bought this coolpix 4300 along with a 256mb ultra flash card . as expected , i happily found that qualities of the picture are excellent with 3m-4m pixel / fine combos and many of the user-friendly functions are very similar to slr models , and with added convenience of a digital camera that you can see pictures immediately .","{'picture quality': 'positive', 'function': 'positive'}",set(),"[0, 0, 0, 0, 0, 0, 0, 0, 0, 0, 0, 0, 0, 0, 0, 0, 0, 0, 0, 0, 0, 0, 0, 0, 0, 0, 0, 0, 0, 0, 0]"
204,"i particularly like the "" txt "" file which records all the control information for all the pictures you take.",{'txt file': 'positive'},set(),"[0, 0, 0, 0, 0, 0, 0, 0, 0, 0, 0, 0, 0, 0, 0, 0, 0, 0, 0, 0, 0, 0, 0, 0, 0, 0, 0, 0, 0, 0, 0]"
205,"try to buy a high capacity ultra card , as it 's 2x as faster as the regular cf card .",{},set(),"[0, 0, 0, 0, 0, 0, 0, 0, 0, 0, 0, 0, 0, 0, 0, 0, 0, 0, 0, 0, 0, 0, 0, 0, 0, 0, 0, 0, 0, 0, 0]"
206,"consider the time you save during picture taking especially not missing a good moment and during download , it 's well worth the little extra money .",{},set(),"[0, 0, 0, 0, 0, 0, 0, 0, 0, 0, 0, 0, 0, 0, 0, 0, 0, 0, 0, 0, 0, 0, 0, 0, 0, 0, 0, 0, 0, 0, 0]"
207,"an extra rechargeable en-el 1 battery is also handy , so you will seldom run into "" out of battery "" situation .",{},set(),"[0, 0, 0, 0, 0, 0, 0, 0, 0, 0, 0, 0, 0, 0, 0, 0, 0, 0, 0, 0, 0, 0, 0, 0, 0, 0, 0, 0, 0, 0, 0]"
208,use the rechargeable because that saves you money and helps the environment in a long run .,{},set(),"[0, 0, 0, 0, 0, 0, 0, 0, 0, 0, 0, 0, 0, 0, 0, 0, 0, 0, 0, 0, 0, 0, 0, 0, 0, 0, 0, 0, 0, 0, 0]"
209,"one thing puzzles me is that for "" fine and 2200 + "" quality pictures , one ultra 256mb cf card can only hold 130-140 pics , but the size of the pictures are only around 1.2 mb , the math does not add up .",{},set(),"[0, 0, 0, 0, 0, 0, 0, 0, 0, 0, 0, 0, 0, 0, 0, 0, 0, 0, 0, 0, 0, 0, 0, 0, 0, 0, 0, 0, 0, 0, 0]"
210,i would expecct the card to hold over 200 pictures for size of 1.2 mb/per .,{},set(),"[0, 0, 0, 0, 0, 0, 0, 0, 0, 0, 0, 0, 0, 0, 0, 0, 0, 0, 0, 0, 0, 0, 0, 0, 0, 0, 0, 0, 0, 0, 0]"
211,anybody can explain that ?,{},set(),"[0, 0, 0, 0, 0, 0, 0, 0, 0, 0, 0, 0, 0, 0, 0, 0, 0, 0, 0, 0, 0, 0, 0, 0, 0, 0, 0, 0, 0, 0, 0]"
212,"a nikon will make you happier and leave you lots of good memories , as always .",{'nikon': 'positive'},"{('nikon', 'positive')}","[0, 1, 0, 0, 0, 0, 0, 0, 0, 0, 0, 0, 0, 0, 0, 0, 0, 0, 0, 0, 0, 0, 0, 0, 0, 0, 0, 0, 0, 0, 0]"
213,i highly recommend this camera to anyone looking for a good digital camera that takes great pictures yet does n't take weeks to figure out how to operate .,"{'picture': 'positive', 'camera': 'positive'}","{('camera', 'positive'), ('take weeks', 'positive')}","[0, 0, 0, 0, 0, 0, 0, 0, 0, 0, 0, 0, 0, 0, 0, 0, 0, 0, 0, 0, 0, 0, 1, 0, 0, 0, 0, 0, 0, 0, 0]"
214,we take this camera with us everywhere and are constantly amazed at the quality of the pictures that we get and the number of different ways the camera allows for pictures to be taken .,{'picture quality': 'positive'},set(),"[0, 0, 0, 0, 0, 0, 0, 0, 0, 0, 0, 0, 0, 0, 0, 0, 0, 0, 0, 0, 0, 0, 0, 0, 0, 0, 0, 0, 0, 0, 0]"
215,i am a picture fanatic so i consider myself picky and if your the same way this camera will not let you down.now buy it !,{'camera': 'positive'},"{('camera', 'positive')}","[0, 0, 0, 0, 0, 1, 0, 0, 0, 0, 0, 0, 0, 0, 0, 0, 0, 0, 0, 0, 0, 0, 0, 0, 0, 0, 0, 0, 0, 0, 0]"
216,"first of all , let 's start with my needs : 1 $ 500 budget 2 4mp resolution , 3 optical clarity and color , 4 fast - very little shutter lag and quick sep-up for next picture , 5 compact size , and 6 good camera grip to minimize camera shake .",{},set(),"[0, 0, 0, 0, 0, 0, 0, 0, 0, 0, 0, 0, 0, 0, 0, 0, 0, 0, 0, 0, 0, 0, 0, 0, 0, 0, 0, 0, 0, 0, 0]"
217,"for three months , i 've researched the internet and magazines , queried various sales personnel , and took hands-on in-store test drives .",{},set(),"[0, 0, 0, 0, 0, 0, 0, 0, 0, 0, 0, 0, 0, 0, 0, 0, 0, 0, 0, 0, 0, 0, 0, 0, 0, 0, 0, 0, 0, 0, 0]"
218,and i finally settled on the nikon coolpix 4300 .,{},set(),"[0, 0, 0, 0, 0, 0, 0, 0, 0, 0, 0, 0, 0, 0, 0, 0, 0, 0, 0, 0, 0, 0, 0, 0, 0, 0, 0, 0, 0, 0, 0]"
219,"i have it for a week now , and this camera has exceeded my expectations .",{'camera': 'positive'},"{('camera', 'positive')}","[0, 1, 0, 0, 0, 0, 0, 0, 0, 0, 0, 0, 0, 0, 0, 0, 0, 0, 0, 0, 0, 0, 0, 0, 0, 0, 0, 0, 0, 0, 0]"
220,the daylight pictures are brilliant and the indoor shots are very good provided that your subject is no more than about 8 feet away .,"{'picture': 'positive', 'indoor shot': 'positive'}",set(),"[0, 0, 0, 0, 0, 0, 0, 0, 0, 0, 0, 0, 0, 0, 0, 0, 0, 0, 0, 0, 0, 0, 0, 0, 0, 0, 0, 0, 0, 0, 0]"
221,the shutter lag is on par with what i 've experienced with point and shoot 35mm and aps film cameras and the next frame advance is about a couple seconds using a high speed 12x 128mb compact flash card a salesperson recommended the high speed card since next frame advance speed was important to me - and it was only a few dollars more .,{},set(),"[0, 0, 0, 0, 0, 0, 0, 0, 0, 0, 0, 0, 0, 0, 0, 0, 0, 0, 0, 0, 0, 0, 0, 0, 0, 0, 0, 0, 0, 0, 0]"
222,"the only drawbacks i 've encountered are : 1 indoor shots from a distance > 8ft lack contrast and color , but i 've found this to be a problem with all cameras with built-in flashes that i 've used even on a nikon slr .",{'indoor shot': 'negative'},set(),"[0, 0, 0, 0, 0, 0, 0, 0, 0, 0, 0, 0, 0, 0, 0, 0, 0, 0, 0, 0, 0, 0, 0, 0, 0, 0, 0, 0, 0, 0, 0]"
223,"right now , i 'm researching for an inexpensive slave flash unit that 's designed for digital cameras .",{},set(),"[0, 0, 0, 0, 0, 0, 0, 0, 0, 0, 0, 0, 0, 0, 0, 0, 0, 0, 0, 0, 0, 0, 0, 0, 0, 0, 0, 0, 0, 0, 0]"
224,2 the battery life seems to be on the short side but adequate for most situations .,{'battery life': 'negative'},set(),"[0, 0, 0, 0, 0, 0, 0, 0, 0, 0, 0, 0, 0, 0, 0, 0, 0, 0, 0, 0, 0, 0, 0, 0, 0, 0, 0, 0, 0, 0, 0]"
225,i got 45 outdoor and 15 indoor shots with the monitor on turning the camera off and on over a 4 hour period before the battery died .,{},set(),"[0, 0, 0, 0, 0, 0, 0, 0, 0, 0, 0, 0, 0, 0, 0, 0, 0, 0, 0, 0, 0, 0, 0, 0, 0, 0, 0, 0, 0, 0, 0]"
226,an extra for a back-up battery would be a good investment .,{},set(),"[0, 0, 0, 0, 0, 0, 0, 0, 0, 0, 0, 0, 0, 0, 0, 0, 0, 0, 0, 0, 0, 0, 0, 0, 0, 0, 0, 0, 0, 0, 0]"
227,"3 the picture editing software it came with is adequate , but not very robust .",{'software': 'negative'},set(),"[0, 0, 0, 0, 0, 0, 0, 0, 0, 0, 0, 0, 0, 0, 0, 0, 0, 0, 0, 0, 0, 0, 0, 0, 0, 0, 0, 0, 0, 0, 0]"
228,i 'll still use my photosuite for editing .,{},set(),"[0, 0, 0, 0, 0, 0, 0, 0, 0, 0, 0, 0, 0, 0, 0, 0, 0, 0, 0, 0, 0, 0, 0, 0, 0, 0, 0, 0, 0, 0, 0]"
229,one more thing about indoor shots - many of the reviews knocked this camera for low light focusing .,{},set(),"[0, 0, 0, 0, 0, 0, 0, 0, 0, 0, 0, 0, 0, 0, 0, 0, 0, 0, 0, 0, 0, 0, 0, 0, 0, 0, 0, 0, 0, 0, 0]"
230,"just for the heck of it , i took it into my dark kitchen with only indirect light coming in though the door , and the focusing was just fine .",{},set(),"[0, 0, 0, 0, 0, 0, 0, 0, 0, 0, 0, 0, 0, 0, 0, 0, 0, 0, 0, 0, 0, 0, 0, 0, 0, 0, 0, 0, 0, 0, 0]"
