,sentence,meta,max_match_extracted,y_true
231,"in summary , i love this camera and would whole-heartedly recommend this to anyone wanting a high quality point and shoot camera in the medium price range .",{'camera': 'positive'},"{('camera', 'positive')}","[0, 0, 0, 0, 0, 0, 0, 0, 0, 0, 0, 0, 0, 0, 0, 0, 0, 0, 0, 0, 0, 0, 0, 0, 0, 0, 0, 0, 1, 0, 0]"
232,"- since i wrote the review above in january 2003 , i still love this camera .",{},set(),"[0, 0, 0, 0, 0, 0, 0, 0, 0, 0, 0, 0, 0, 0, 0, 0, 0, 0, 0, 0, 0, 0, 0, 0, 0, 0, 0, 0, 0, 0, 0]"
233,i 've picked up a few accessories that i found to be useful .,{},set(),"[0, 0, 0, 0, 0, 0, 0, 0, 0, 0, 0, 0, 0, 0, 0, 0, 0, 0, 0, 0, 0, 0, 0, 0, 0, 0, 0, 0, 0, 0, 0]"
234,i bought a digi-slave dsf-1s flash unit .,{},set(),"[0, 0, 0, 0, 0, 0, 0, 0, 0, 0, 0, 0, 0, 0, 0, 0, 0, 0, 0, 0, 0, 0, 0, 0, 0, 0, 0, 0, 0, 0, 0]"
235,"i do n't use a bracket , i just hold it above my head and aim the flash with my left hand .",{},set(),"[0, 0, 0, 0, 0, 0, 0, 0, 0, 0, 0, 0, 0, 0, 0, 0, 0, 0, 0, 0, 0, 0, 0, 0, 0, 0, 0, 0, 0, 0, 0]"
236,"i also got a ur-e 4 step down ring adapter , lc-e 900 lens cap , and the nikon 28mm filter set .",{},set(),"[0, 0, 0, 0, 0, 0, 0, 0, 0, 0, 0, 0, 0, 0, 0, 0, 0, 0, 0, 0, 0, 0, 0, 0, 0, 0, 0, 0, 0, 0, 0]"
237,this provides added protection for the camera lens and allows the use of filters .,{},set(),"[0, 0, 0, 0, 0, 0, 0, 0, 0, 0, 0, 0, 0, 0, 0, 0, 0, 0, 0, 0, 0, 0, 0, 0, 0, 0, 0, 0, 0, 0, 0]"
238,i leave the adapter and uv filter on all the time .,{},set(),"[0, 0, 0, 0, 0, 0, 0, 0, 0, 0, 0, 0, 0, 0, 0, 0, 0, 0, 0, 0, 0, 0, 0, 0, 0, 0, 0, 0, 0, 0, 0]"
239,this also allows you to turn on the camera on without having to remove the lens cap .,{},set(),"[0, 0, 0, 0, 0, 0, 0, 0, 0, 0, 0, 0, 0, 0, 0, 0, 0, 0, 0, 0, 0, 0, 0, 0, 0, 0, 0, 0, 0, 0, 0]"
240,"the downside is that you might accidentally take pictures with the lens cap on , the camera wo n't fit in the small cases , and 28mm filters are expensive and hard to find .",{},set(),"[0, 0, 0, 0, 0, 0, 0, 0, 0, 0, 0, 0, 0, 0, 0, 0, 0, 0, 0, 0, 0, 0, 0, 0, 0, 0, 0, 0, 0, 0, 0]"
241,great camera .,{'camera': 'positive'},"{('camera', 'positive')}","[0, 0, 0, 1, 0, 0, 0, 0, 0, 0, 0, 0, 0, 0, 0, 0, 0, 0, 0, 0, 0, 0, 0, 0, 0, 0, 0, 0, 0, 0, 0]"
242,i am impressed with how easy this camera is to use .,{'use': 'positive'},set(),"[0, 0, 0, 0, 0, 0, 0, 0, 0, 0, 0, 0, 0, 0, 0, 0, 0, 0, 0, 0, 0, 0, 0, 0, 0, 0, 0, 0, 0, 0, 0]"
243,it takes great pictures .,{'picture': 'positive'},set(),"[0, 0, 0, 0, 0, 0, 0, 0, 0, 0, 0, 0, 0, 0, 0, 0, 0, 0, 0, 0, 0, 0, 0, 0, 0, 0, 0, 0, 0, 0, 0]"
244,"the manual is easy to understand , and it is mostly idiot proof .",{'manual': 'positive'},set(),"[0, 0, 0, 0, 0, 0, 0, 0, 0, 0, 0, 0, 0, 0, 0, 0, 0, 0, 0, 0, 0, 0, 0, 0, 0, 0, 0, 0, 0, 0, 0]"
245,i have not yet figured out how to make it snap quick pictures for action shots .,{},set(),"[0, 0, 0, 0, 0, 0, 0, 0, 0, 0, 0, 0, 0, 0, 0, 0, 0, 0, 0, 0, 0, 0, 0, 0, 0, 0, 0, 0, 0, 0, 0]"
246,now where did i put that manual ?,{},set(),"[0, 0, 0, 0, 0, 0, 0, 0, 0, 0, 0, 0, 0, 0, 0, 0, 0, 0, 0, 0, 0, 0, 0, 0, 0, 0, 0, 0, 0, 0, 0]"
247,do n't let my five star rating fool you .,{},set(),"[0, 0, 0, 0, 0, 0, 0, 0, 0, 0, 0, 0, 0, 0, 0, 0, 0, 0, 0, 0, 0, 0, 0, 0, 0, 0, 0, 0, 0, 0, 0]"
248,the nikon coolpix 4300 deserves six .,{},set(),"[0, 0, 0, 0, 0, 0, 0, 0, 0, 0, 0, 0, 0, 0, 0, 0, 0, 0, 0, 0, 0, 0, 0, 0, 0, 0, 0, 0, 0, 0, 0]"
249,i got this camera about a month ago and i can 't put it down .,{'camera': 'positive'},"{('camera', 'positive')}","[0, 0, 0, 0, 1, 0, 0, 0, 0, 0, 0, 0, 0, 0, 0, 0, 0, 0, 0, 0, 0, 0, 0, 0, 0, 0, 0, 0, 0, 0, 0]"
250,"i was considering buying the minolta f-100 and the sony dsc-p 9 , but at the camera shop , realized this one went above and beyond .",{},set(),"[0, 0, 0, 0, 0, 0, 0, 0, 0, 0, 0, 0, 0, 0, 0, 0, 0, 0, 0, 0, 0, 0, 0, 0, 0, 0, 0, 0, 0, 0, 0]"
251,i selected the 4300 right away and have gotten high quality pictures every time .,{'picture quality': 'positive'},set(),"[0, 0, 0, 0, 0, 0, 0, 0, 0, 0, 0, 0, 0, 0, 0, 0, 0, 0, 0, 0, 0, 0, 0, 0, 0, 0, 0, 0, 0, 0, 0]"
252,autofocus feels exactly like my film camera while scene and manual mode add a little fun challenge to it all .,"{'manual mode': 'positive', 'scene mode': 'positive', 'autofocus': 'positive'}","{('manual mode', 'positive'), ('scene', 'positive')}","[0, 1, 0, 0, 0, 0, 0, 0, 0, 0, 0, 0, 0, 0, 0, 0, 0, 0, 0, 0, 0, 0, 0, 0, 0, 0, 0, 0, 0, 0, 0]"
253,i would also recommend buying an extra battery and at least a 128 mb compact flash type i memory card .,{},set(),"[0, 0, 0, 0, 0, 0, 0, 0, 0, 0, 0, 0, 0, 0, 0, 0, 0, 0, 0, 0, 0, 0, 0, 0, 0, 0, 0, 0, 0, 0, 0]"
254,buy this camera and savour it .,{},set(),"[0, 0, 0, 0, 0, 0, 0, 0, 0, 0, 0, 0, 0, 0, 0, 0, 0, 0, 0, 0, 0, 0, 0, 0, 0, 0, 0, 0, 0, 0, 0]"
255,i reviewed several digital cameras before settling on this one .,{},set(),"[0, 0, 0, 0, 0, 0, 0, 0, 0, 0, 0, 0, 0, 0, 0, 0, 0, 0, 0, 0, 0, 0, 0, 0, 0, 0, 0, 0, 0, 0, 0]"
256,this one was rated very high by several people check out this site and epinions.com .,{},set(),"[0, 0, 0, 0, 0, 0, 0, 0, 0, 0, 0, 0, 0, 0, 0, 0, 0, 0, 0, 0, 0, 0, 0, 0, 0, 0, 0, 0, 0, 0, 0]"
257,picture quality in outdoor settings is indistinguishable from 35mm .,{'picture quality': 'positive'},set(),"[0, 0, 0, 0, 0, 0, 0, 0, 0, 0, 0, 0, 0, 0, 0, 0, 0, 0, 0, 0, 0, 0, 0, 0, 0, 0, 0, 0, 0, 0, 0]"
258,"on average , indoor shots with a flash are not quite as good as 35mm .",{'indoor shot': 'negative'},set(),"[0, 0, 0, 0, 0, 0, 0, 0, 0, 0, 0, 0, 0, 0, 0, 0, 0, 0, 0, 0, 0, 0, 0, 0, 0, 0, 0, 0, 0, 0, 0]"
259,"however , the convenience of using digital far outweighs the slightly less accurate indoor pictures .",{},set(),"[0, 0, 0, 0, 0, 0, 0, 0, 0, 0, 0, 0, 0, 0, 0, 0, 0, 0, 0, 0, 0, 0, 0, 0, 0, 0, 0, 0, 0, 0, 0]"
260,i am extremely satisfied with this camera .,{'camera': 'positive'},"{('camera', 'positive')}","[0, 0, 0, 0, 0, 0, 0, 0, 0, 1, 0, 0, 0, 0, 0, 0, 0, 0, 0, 0, 0, 0, 0, 0, 0, 0, 0, 0, 0, 0, 0]"
261,i purchased it from amazon on a since discontinued promotion .,{},set(),"[0, 0, 0, 0, 0, 0, 0, 0, 0, 0, 0, 0, 0, 0, 0, 0, 0, 0, 0, 0, 0, 0, 0, 0, 0, 0, 0, 0, 0, 0, 0]"
262,buy an extra battery - life is good but still somewhat short .,{},set(),"[0, 0, 0, 0, 0, 0, 0, 0, 0, 0, 0, 0, 0, 0, 0, 0, 0, 0, 0, 0, 0, 0, 0, 0, 0, 0, 0, 0, 0, 0, 0]"
263,do n't buy this camera if you are not going to purchase a 128 megabyte card .,{},set(),"[0, 0, 0, 0, 0, 0, 0, 0, 0, 0, 0, 0, 0, 0, 0, 0, 0, 0, 0, 0, 0, 0, 0, 0, 0, 0, 0, 0, 0, 0, 0]"
264,you need the storage to hold a decent amount of shots at 4 megapixel resolution .,{},set(),"[0, 0, 0, 0, 0, 0, 0, 0, 0, 0, 0, 0, 0, 0, 0, 0, 0, 0, 0, 0, 0, 0, 0, 0, 0, 0, 0, 0, 0, 0, 0]"
265,i have one thing to say to the numbskulls who complain that this camera 's controls are confusing and hard to remember :,{},set(),"[0, 0, 0, 0, 0, 0, 0, 0, 0, 0, 0, 0, 0, 0, 0, 0, 0, 0, 0, 0, 0, 0, 0, 0, 0, 0, 0, 0, 0, 0, 0]"
266,read the directions !,{},set(),"[0, 0, 0, 0, 0, 0, 0, 0, 0, 0, 0, 0, 0, 0, 0, 0, 0, 0, 0, 0, 0, 0, 0, 0, 0, 0, 0, 0, 0, 0, 0]"
267,the regular mode in this camera works for 80 % of settings .,{},set(),"[0, 0, 0, 0, 0, 0, 0, 0, 0, 0, 0, 0, 0, 0, 0, 0, 0, 0, 0, 0, 0, 0, 0, 0, 0, 0, 0, 0, 0, 0, 0]"
268,"the "" scene "" mode works well for the remainder of shots that are not going to be in a "" regular "" setting .",{'scene mode': 'positive'},set(),"[0, 0, 0, 0, 0, 0, 0, 0, 0, 0, 0, 0, 0, 0, 0, 0, 0, 0, 0, 0, 0, 0, 0, 0, 0, 0, 0, 0, 0, 0, 0]"
269,i wish the camera had a higher optical zoom so that i could take better wildlife photos .,{},set(),"[0, 0, 0, 0, 0, 0, 0, 0, 0, 0, 0, 0, 0, 0, 0, 0, 0, 0, 0, 0, 0, 0, 0, 0, 0, 0, 0, 0, 0, 0, 0]"
270,"however , its 3x optical setting is acceptable for 70 % of the shots that i take .",{'optical setting': 'positive'},"{('optical setting', 'positive')}","[0, 1, 0, 0, 0, 0, 0, 0, 0, 0, 0, 0, 0, 0, 0, 0, 0, 0, 0, 0, 0, 0, 0, 0, 0, 0, 0, 0, 0, 0, 0]"
271,"buy this camera , you wo n't regret it .",{},set(),"[0, 0, 0, 0, 0, 0, 0, 0, 0, 0, 0, 0, 0, 0, 0, 0, 0, 0, 0, 0, 0, 0, 0, 0, 0, 0, 0, 0, 0, 0, 0]"
272,"if you 're looking for a small , compact , super resolution digital camera , you can end your search with the nikon 4300 !",{'camera': 'positive'},"{('camera', 'positive'), ('resolution', 'positive')}","[0, 0, 0, 1, 0, 0, 0, 0, 0, 0, 0, 0, 0, 0, 0, 0, 0, 0, 0, 0, 0, 0, 0, 0, 0, 0, 0, 0, 0, 0, 0]"
273,"after a lengthy and extensive journey for a feature-loaded , high performance , travel size camera , i initially gravitated to this little gem because of the superior picture quality 4 mega pixel .",{'picture quality': 'positive'},set(),"[0, 0, 0, 0, 0, 0, 0, 0, 0, 0, 0, 0, 0, 0, 0, 0, 0, 0, 0, 0, 0, 0, 0, 0, 0, 0, 0, 0, 0, 0, 0]"
274,"after using it for about a month , i can state unequivocably that this nikon definitely delivers a huge bang for the buck .",{'nikon': 'positive'},"{('nikon', 'positive')}","[0, 1, 0, 0, 0, 0, 0, 0, 0, 0, 0, 0, 0, 0, 0, 0, 0, 0, 0, 0, 0, 0, 0, 0, 0, 0, 0, 0, 0, 0, 0]"
275,its easy to use and the sheer fun of being able to use an array of nikon accessories like the telephoto and wide-angle lenses is the proverbial icing on the cake .,"{'accessory': 'positive', 'use': 'positive'}",set(),"[0, 0, 0, 0, 0, 0, 0, 0, 0, 0, 0, 0, 0, 0, 0, 0, 0, 0, 0, 0, 0, 0, 0, 0, 0, 0, 0, 0, 0, 0, 0]"
276,"yes , the picture quality and features which are too numerous to mention are unmatched for any camera in this price range .","{'picture quality': 'positive', 'feature': 'positive'}",set(),"[0, 0, 0, 0, 0, 0, 0, 0, 0, 0, 0, 0, 0, 0, 0, 0, 0, 0, 0, 0, 0, 0, 0, 0, 0, 0, 0, 0, 0, 0, 0]"
277,the design and construction are excellent -- as is the legendary quality of the nikon optics .,"{'design': 'positive', 'optic': 'positive', 'construction': 'positive'}","{('design', 'positive'), ('construction', 'positive')}","[0, 1, 0, 0, 0, 0, 0, 0, 0, 0, 0, 0, 0, 0, 0, 0, 0, 0, 0, 0, 0, 0, 0, 0, 0, 0, 0, 0, 0, 0, 0]"
278,i own a 35mm slr camera and this is my second digital .,{},set(),"[0, 0, 0, 0, 0, 0, 0, 0, 0, 0, 0, 0, 0, 0, 0, 0, 0, 0, 0, 0, 0, 0, 0, 0, 0, 0, 0, 0, 0, 0, 0]"
279,"if you 're seeking that elusive state of photographic euphoria that is free of buyer 's remorse and filled with cool , then travel to the world of the coolpix 4300 !",{},set(),"[0, 0, 0, 0, 0, 0, 0, 0, 0, 0, 0, 0, 0, 0, 0, 0, 0, 0, 0, 0, 0, 0, 0, 0, 0, 0, 0, 0, 0, 0, 0]"
280,had it for a week .,{},set(),"[0, 0, 0, 0, 0, 0, 0, 0, 0, 0, 0, 0, 0, 0, 0, 0, 0, 0, 0, 0, 0, 0, 0, 0, 0, 0, 0, 0, 0, 0, 0]"
281,"there are so many functions in this little , yet powerful camera !",{'camera': 'positive'},"{('camera', 'positive'), ('functions', 'positive')}","[0, 0, 0, 1, 0, 0, 0, 0, 0, 0, 0, 0, 0, 0, 0, 0, 0, 0, 0, 0, 0, 0, 0, 0, 0, 0, 0, 0, 0, 0, 0]"
282,"my room is so dark and when i tried taking pics of it with my old camera , they came out black , but with this , they look the same in the picture as in real life .",{},set(),"[0, 0, 0, 0, 0, 0, 0, 0, 0, 0, 0, 0, 0, 0, 0, 0, 0, 0, 0, 0, 0, 0, 0, 0, 0, 0, 0, 0, 0, 0, 0]"
283,"better actually cause my carpet looks clean , lol .",{},set(),"[0, 0, 0, 0, 0, 0, 0, 0, 0, 0, 0, 0, 0, 0, 0, 0, 0, 0, 0, 0, 0, 0, 0, 0, 0, 0, 0, 0, 0, 0, 0]"
284,but this camera is great !,{'camera': 'positive'},"{('camera', 'positive')}","[0, 1, 0, 0, 0, 0, 0, 0, 0, 0, 0, 0, 0, 0, 0, 0, 0, 0, 0, 0, 0, 0, 0, 0, 0, 0, 0, 0, 0, 0, 0]"
285,the picture quality is amazing and you can connect it to your tv and could make silent movies that way if you wanted to .,"{'picture quality': 'positive', 'movie': 'positive'}",set(),"[0, 0, 0, 0, 0, 0, 0, 0, 0, 0, 0, 0, 0, 0, 0, 0, 0, 0, 0, 0, 0, 0, 0, 0, 0, 0, 0, 0, 0, 0, 0]"
286,"i can 't connect it to my computer though , but that 's a problem with windows me , not the camera .",{},set(),"[0, 0, 0, 0, 0, 0, 0, 0, 0, 0, 0, 0, 0, 0, 0, 0, 0, 0, 0, 0, 0, 0, 0, 0, 0, 0, 0, 0, 0, 0, 0]"
287,"if you have windows me you should upgrade to xp anyway , lol .",{},set(),"[0, 0, 0, 0, 0, 0, 0, 0, 0, 0, 0, 0, 0, 0, 0, 0, 0, 0, 0, 0, 0, 0, 0, 0, 0, 0, 0, 0, 0, 0, 0]"
288,but it works perfectly fine on my parent 's computer .,{},set(),"[0, 0, 0, 0, 0, 0, 0, 0, 0, 0, 0, 0, 0, 0, 0, 0, 0, 0, 0, 0, 0, 0, 0, 0, 0, 0, 0, 0, 0, 0, 0]"
289,"it does have a lense cap , but it wo n't let you take pics with it on which is real good .",{'lense cap': 'positive'},"{('lense cap', 'positive')}","[0, 0, 0, 0, 0, 0, 0, 1, 0, 0, 0, 0, 0, 0, 0, 0, 0, 0, 0, 0, 0, 0, 0, 0, 0, 0, 0, 0, 0, 0, 0]"
290,the battery recharges ral fast and the recharger thingy that comes with is real nice .,{'battery': 'positive'},"{('battery', 'positive')}","[0, 0, 0, 0, 0, 0, 0, 0, 0, 0, 0, 0, 0, 0, 0, 0, 0, 0, 0, 0, 1, 0, 0, 0, 0, 0, 0, 0, 0, 0, 0]"
291,"ooh , and i dropped it and it still works fine : this little camera has so many features i have n't even gotten to all of them yet .",{'camera': 'positive'},set(),"[0, 0, 0, 0, 0, 0, 0, 0, 0, 0, 0, 0, 0, 0, 0, 0, 0, 0, 0, 0, 0, 0, 0, 0, 0, 0, 0, 0, 0, 0, 0]"
292,"i did quite a bit of research before buying this camera , and this one had everything i was looking for .",{},set(),"[0, 0, 0, 0, 0, 0, 0, 0, 0, 0, 0, 0, 0, 0, 0, 0, 0, 0, 0, 0, 0, 0, 0, 0, 0, 0, 0, 0, 0, 0, 0]"
293,"it 's easy for beginners to use , but has features that more serious photographers will love , so it 's an excellent camera to grow into .","{'use': 'positive', 'camera': 'positive', 'feature': 'positive'}","{('camera', 'positive'), ('photographers', 'positive')}","[0, 0, 0, 1, 0, 0, 0, 0, 0, 0, 0, 0, 0, 0, 0, 0, 0, 0, 0, 0, 0, 0, 0, 0, 0, 0, 0, 0, 0, 0, 0]"
294,"i love the continuous shot mode , which allows you to take up to 16 pix in rapid succession -- great for action shots .",{'continuous shot mode': 'positive'},"{('rapid succession', 'positive'), ('continuous shot mode', 'positive')}","[0, 0, 0, 0, 0, 0, 0, 1, 0, 0, 0, 0, 0, 0, 0, 0, 0, 0, 0, 0, 0, 0, 0, 0, 0, 0, 0, 0, 0, 0, 0]"
295,i 'm amazed at the photo quality -- prints are indistinguishable from 35mm prints .,"{'photo quality': 'positive', 'print': 'positive'}",set(),"[0, 0, 0, 0, 0, 0, 0, 0, 0, 0, 0, 0, 0, 0, 0, 0, 0, 0, 0, 0, 0, 0, 0, 0, 0, 0, 0, 0, 0, 0, 0]"
296,"i only have one complaint , and that is the 8mb card included .",{'mb card': 'negative'},set(),"[0, 0, 0, 0, 0, 0, 0, 0, 0, 0, 0, 0, 0, 0, 0, 0, 0, 0, 0, 0, 0, 0, 0, 0, 0, 0, 0, 0, 0, 0, 0]"
297,8mb for a camera like this is a joke .,{'mb': 'negative'},set(),"[0, 0, 0, 0, 0, 0, 0, 0, 0, 0, 0, 0, 0, 0, 0, 0, 0, 0, 0, 0, 0, 0, 0, 0, 0, 0, 0, 0, 0, 0, 0]"
298,a card with more memory is a must .,{},set(),"[0, 0, 0, 0, 0, 0, 0, 0, 0, 0, 0, 0, 0, 0, 0, 0, 0, 0, 0, 0, 0, 0, 0, 0, 0, 0, 0, 0, 0, 0, 0]"
299,"a minor quibble , since most cameras on the market still only include the 8mb cards .",{},set(),"[0, 0, 0, 0, 0, 0, 0, 0, 0, 0, 0, 0, 0, 0, 0, 0, 0, 0, 0, 0, 0, 0, 0, 0, 0, 0, 0, 0, 0, 0, 0]"
300,"if you do any research into digital cameras , you 'll quickly find that this camera is just about the best value out there .",{},set(),"[0, 0, 0, 0, 0, 0, 0, 0, 0, 0, 0, 0, 0, 0, 0, 0, 0, 0, 0, 0, 0, 0, 0, 0, 0, 0, 0, 0, 0, 0, 0]"
301,these are the reasons i think it 's great :,{},set(),"[0, 0, 0, 0, 0, 0, 0, 0, 0, 0, 0, 0, 0, 0, 0, 0, 0, 0, 0, 0, 0, 0, 0, 0, 0, 0, 0, 0, 0, 0, 0]"
302,1 it has all the features an amatuer photo-enthusiast would want .,{'feature': 'positive'},set(),"[0, 0, 0, 0, 0, 0, 0, 0, 0, 0, 0, 0, 0, 0, 0, 0, 0, 0, 0, 0, 0, 0, 0, 0, 0, 0, 0, 0, 0, 0, 0]"
303,2 it is easy enough for my grandmother to use .,{'use': 'positive'},set(),"[0, 0, 0, 0, 0, 0, 0, 0, 0, 0, 0, 0, 0, 0, 0, 0, 0, 0, 0, 0, 0, 0, 0, 0, 0, 0, 0, 0, 0, 0, 0]"
304,4 it has optional lenses like wide angles and extra zooms .,{},set(),"[0, 0, 0, 0, 0, 0, 0, 0, 0, 0, 0, 0, 0, 0, 0, 0, 0, 0, 0, 0, 0, 0, 0, 0, 0, 0, 0, 0, 0, 0, 0]"
305,"5 for "" digital film "" it uses compact flash cards , which are easy to find , cheap , reliable and supported by many other devices you may have at hoome .",{},set(),"[0, 0, 0, 0, 0, 0, 0, 0, 0, 0, 0, 0, 0, 0, 0, 0, 0, 0, 0, 0, 0, 0, 0, 0, 0, 0, 0, 0, 0, 0, 0]"
306,6 the nikon coolpix line is a well-established line so you know support and parts are going to be available even when nikon releases a newer model .,{'nikon support': 'positive'},set(),"[0, 0, 0, 0, 0, 0, 0, 0, 0, 0, 0, 0, 0, 0, 0, 0, 0, 0, 0, 0, 0, 0, 0, 0, 0, 0, 0, 0, 0, 0, 0]"
307,7 picture quality is excellent .,{'picture quality': 'positive'},set(),"[0, 0, 0, 0, 0, 0, 0, 0, 0, 0, 0, 0, 0, 0, 0, 0, 0, 0, 0, 0, 0, 0, 0, 0, 0, 0, 0, 0, 0, 0, 0]"
308,8 battery life is excellent .,{'battery life': 'positive'},"{('battery life', 'positive')}","[0, 1, 0, 0, 0, 0, 0, 0, 0, 0, 0, 0, 0, 0, 0, 0, 0, 0, 0, 0, 0, 0, 0, 0, 0, 0, 0, 0, 0, 0, 0]"
309,9 3x built-in optical zoom is a lot for this price range .,{'optical zoom': 'positive'},"{('optical zoom', 'positive')}","[0, 0, 0, 0, 0, 0, 0, 1, 0, 0, 0, 0, 0, 0, 0, 0, 0, 0, 0, 0, 0, 0, 0, 0, 0, 0, 0, 0, 0, 0, 0]"
310,10 great price for all the features .,{'price': 'positive'},"{('price', 'positive')}","[0, 0, 0, 1, 0, 0, 0, 0, 0, 0, 0, 0, 0, 0, 0, 0, 0, 0, 0, 0, 0, 0, 0, 0, 0, 0, 0, 0, 0, 0, 0]"
311,here 's what you may miss or be annoyed by with this camera :,{},set(),"[0, 0, 0, 0, 0, 0, 0, 0, 0, 0, 0, 0, 0, 0, 0, 0, 0, 0, 0, 0, 0, 0, 0, 0, 0, 0, 0, 0, 0, 0, 0]"
312,1 no direct firewire to the camera .,{'firewire': 'negative'},set(),"[0, 0, 0, 0, 0, 0, 0, 0, 0, 0, 0, 0, 0, 0, 0, 0, 0, 0, 0, 0, 0, 0, 0, 0, 0, 0, 0, 0, 0, 0, 0]"
313,"there is usb , though .",{},set(),"[0, 0, 0, 0, 0, 0, 0, 0, 0, 0, 0, 0, 0, 0, 0, 0, 0, 0, 0, 0, 0, 0, 0, 0, 0, 0, 0, 0, 0, 0, 0]"
314,"2 the camera is so small that when you attach some lenses i have the 19mm wide-angle -- wc-e 68 , the optical viewfinder is partially obscured .",{'viewfinder': 'negative'},set(),"[0, 0, 0, 0, 0, 0, 0, 0, 0, 0, 0, 0, 0, 0, 0, 0, 0, 0, 0, 0, 0, 0, 0, 0, 0, 0, 0, 0, 0, 0, 0]"
315,"this does n't affect the picture , of course .",{},set(),"[0, 0, 0, 0, 0, 0, 0, 0, 0, 0, 0, 0, 0, 0, 0, 0, 0, 0, 0, 0, 0, 0, 0, 0, 0, 0, 0, 0, 0, 0, 0]"
316,you just have to use the lcd viewfinder to see the whole picture .,{},set(),"[0, 0, 0, 0, 0, 0, 0, 0, 0, 0, 0, 0, 0, 0, 0, 0, 0, 0, 0, 0, 0, 0, 0, 0, 0, 0, 0, 0, 0, 0, 0]"
317,it 's no problem for me personally .,{},set(),"[0, 0, 0, 0, 0, 0, 0, 0, 0, 0, 0, 0, 0, 0, 0, 0, 0, 0, 0, 0, 0, 0, 0, 0, 0, 0, 0, 0, 0, 0, 0]"
318,3 battery has to be removed to recharge .,{},set(),"[0, 0, 0, 0, 0, 0, 0, 0, 0, 0, 0, 0, 0, 0, 0, 0, 0, 0, 0, 0, 0, 0, 0, 0, 0, 0, 0, 0, 0, 0, 0]"
319,"4 an ac adapter for powering the camera while the battery 's out is not included , although one can be purchased separately .",{},set(),"[0, 0, 0, 0, 0, 0, 0, 0, 0, 0, 0, 0, 0, 0, 0, 0, 0, 0, 0, 0, 0, 0, 0, 0, 0, 0, 0, 0, 0, 0, 0]"
320,5 two different adapters -- ur-e 4 and ur-e 7 -- are required for some attachment lenses .,{},set(),"[0, 0, 0, 0, 0, 0, 0, 0, 0, 0, 0, 0, 0, 0, 0, 0, 0, 0, 0, 0, 0, 0, 0, 0, 0, 0, 0, 0, 0, 0, 0]"
321,"most of these "" annoyances "" , though , are comparable to what you 'll find on other cameras in this price range .",{},set(),"[0, 0, 0, 0, 0, 0, 0, 0, 0, 0, 0, 0, 0, 0, 0, 0, 0, 0, 0, 0, 0, 0, 0, 0, 0, 0, 0, 0, 0, 0, 0]"
322,"i am new to the whole digital camera thing ; well , new to the whole camera thing period , really .",{},set(),"[0, 0, 0, 0, 0, 0, 0, 0, 0, 0, 0, 0, 0, 0, 0, 0, 0, 0, 0, 0, 0, 0, 0, 0, 0, 0, 0, 0, 0, 0, 0]"
323,the auto-mode is good enough for most shots but the 4300 also boasts 12 versatile scene modes as well as a manual mode though i admit i have n't played with it too much on manual .,"{'manual mode': 'positive', 'scene mode': 'positive', 'auto mode': 'positive'}","{('shots', 'positive'), ('manual mode', 'positive'), ('versatile scene modes', 'positive')}","[0, 0, 0, 0, 0, 0, 0, 1, 0, 0, 0, 0, 0, 0, 0, 0, 0, 0, 0, 0, 0, 0, 0, 0, 0, 0, 0, 0, 0, 0, 0]"
324,it 's size also makes it ideal for travel .,{'size': 'positive'},"{('size', 'positive')}","[0, 0, 0, 0, 0, 0, 0, 0, 0, 0, 0, 0, 0, 0, 0, 0, 0, 0, 0, 0, 0, 0, 0, 0, 0, 0, 0, 1, 0, 0, 0]"
325,"overall the nikon 4300 is a very dependable , robust , and useful little camera .",{'camera': 'positive'},set(),"[0, 0, 0, 0, 0, 0, 0, 0, 0, 0, 0, 0, 0, 0, 0, 0, 0, 0, 0, 0, 0, 0, 0, 0, 0, 0, 0, 0, 0, 0, 0]"
326,awesome camera with huge print quality in a tiny package .,"{'print quality': 'positive', 'camera': 'positive'}","{('camera', 'positive'), ('package', 'positive'), ('print', 'positive')}","[0, 0, 0, 1, 0, 0, 0, 0, 0, 0, 0, 0, 0, 0, 0, 0, 0, 0, 0, 0, 0, 0, 0, 0, 0, 0, 0, 0, 0, 0, 0]"
327,"the same 4mp chip from the 4500 camera , plus a 3x zoom with the ability to expand upon that with extenders , great closeup mode , long lasting rechargable battery , etc etc.","{'closeup mode': 'positive', 'battery': 'positive'}","{('battery', 'positive'), ('closeup mode', 'positive')}","[0, 0, 0, 1, 0, 0, 0, 0, 0, 0, 0, 0, 0, 0, 0, 0, 0, 0, 0, 0, 0, 0, 0, 0, 0, 0, 0, 0, 0, 0, 0]"
328,"in my opinion it 's the best camera for the money if you 're looking for something that 's easy to use , small good for travel , and provides excellent , sharp images .",{'camera': 'positive'},"{('camera', 'positive')}","[0, 0, 0, 0, 0, 0, 0, 0, 0, 0, 1, 0, 0, 0, 0, 0, 0, 0, 0, 0, 0, 0, 0, 0, 0, 0, 0, 0, 0, 0, 0]"
