,sentence,meta,max_match_extracted,y_true
0,this camera is perfect for an enthusiastic amateur photographer .,{'camera': 'positive'},"{('camera', 'positive')}","[0, 1, 0, 0, 0, 0, 0, 0, 0, 0, 0, 0, 0, 0, 0, 0, 0, 0, 0, 0, 0, 0, 0, 0, 0, 0, 0, 0, 0, 0, 0]"
1,"the pictures are razor-sharp , even in macro .","{'picture': 'positive', 'macro': 'positive'}",set(),"[0, 0, 0, 0, 0, 0, 0, 0, 0, 0, 0, 0, 0, 0, 0, 0, 0, 0, 0, 0, 0, 0, 0, 0, 0, 0, 0, 0, 0, 0, 0]"
2,the manual does a fine job filling in any blanks that remain .,{'manual': 'positive'},"{('manual', 'positive')}","[0, 0, 0, 0, 0, 0, 0, 0, 0, 0, 0, 0, 0, 0, 0, 0, 0, 0, 0, 0, 1, 0, 0, 0, 0, 0, 0, 0, 0, 0, 0]"
3,"the auto-focus performs well , but i love having the 12 optional scene modes - they are dummy-proof , and correspond to many situations in which i would actually seek to use the camera .","{'auto focus': 'positive', 'scene mode': 'positive'}",set(),"[0, 0, 0, 0, 0, 0, 0, 0, 0, 0, 0, 0, 0, 0, 0, 0, 0, 0, 0, 0, 0, 0, 0, 0, 0, 0, 0, 0, 0, 0, 0]"
4,"comes with a 16 mb compact flash and one rechargable battery the charging unit , included , is fast and small .",{'rechargable battery': 'positive'},"{('rechargable battery', 'positive'), ('compact flash', 'positive')}","[0, 0, 0, 0, 0, 0, 0, 1, 0, 0, 0, 0, 0, 0, 0, 0, 0, 0, 0, 0, 0, 0, 0, 0, 0, 0, 0, 0, 0, 0, 0]"
5,"i bought a 256 mb cf and a second battery , so it 's good to go on a long vacation .",{},set(),"[0, 0, 0, 0, 0, 0, 0, 0, 0, 0, 0, 0, 0, 0, 0, 0, 0, 0, 0, 0, 0, 0, 0, 0, 0, 0, 0, 0, 0, 0, 0]"
6,i enthusiastically recommend this camera .,{'camera': 'positive'},"{('camera', 'positive')}","[0, 0, 0, 0, 0, 0, 0, 0, 0, 0, 0, 0, 0, 0, 0, 0, 0, 0, 0, 0, 0, 0, 1, 0, 0, 0, 0, 0, 0, 0, 0]"
7,"i got my camera three days back , and although i had some experience with digital cameras prior to purchasing this one , i still rate myself as a beginner .",{},set(),"[0, 0, 0, 0, 0, 0, 0, 0, 0, 0, 0, 0, 0, 0, 0, 0, 0, 0, 0, 0, 0, 0, 0, 0, 0, 0, 0, 0, 0, 0, 0]"
8,i bought this camera because it fit my budget and the pre-production and production model reviews were positive .,{},set(),"[0, 0, 0, 0, 0, 0, 0, 0, 0, 0, 0, 0, 0, 0, 0, 0, 0, 0, 0, 0, 0, 0, 0, 0, 0, 0, 0, 0, 0, 0, 0]"
9,"in the auto mode it functions basically as a point and click , the scene modes are very easy to use and produce good results .","{'scene mode': 'positive', 'auto mode': 'positive'}",set(),"[0, 0, 0, 0, 0, 0, 0, 0, 0, 0, 0, 0, 0, 0, 0, 0, 0, 0, 0, 0, 0, 0, 0, 0, 0, 0, 0, 0, 0, 0, 0]"
10,the manual mode is feature rich and i can 't wait to get the hang of it .,{'manual mode': 'positive'},"{('manual mode', 'positive')}","[0, 1, 0, 0, 0, 0, 0, 0, 0, 0, 0, 0, 0, 0, 0, 0, 0, 0, 0, 0, 0, 0, 0, 0, 0, 0, 0, 0, 0, 0, 0]"
11,"the macro mode is exceptional , the pictures are very clear and you can take the pictures with the lens unbelievably close the subject .","{'macro mode': 'positive', 'picture': 'positive'}","{('pictures', 'positive'), ('macro mode', 'positive')}","[0, 0, 0, 0, 0, 0, 0, 0, 0, 0, 0, 0, 0, 0, 0, 0, 0, 0, 0, 0, 1, 0, 0, 0, 0, 0, 0, 0, 0, 0, 0]"
12,"the battery life is very good , i got about 90 minutes with the lcd turned on all the time , the first time around , and i have been using it with the lcd off every now and then , and have yet needed to recharge it .",{'battery life': 'positive'},"{('battery life', 'positive')}","[0, 0, 0, 0, 0, 0, 0, 0, 0, 0, 0, 0, 0, 0, 0, 0, 0, 0, 0, 0, 1, 0, 0, 0, 0, 0, 0, 0, 0, 0, 0]"
13,"the camera comes with a lexar 16mb starter card , which stores about 10 images in fine mode at the highest resolution , i intend to buy a bigger card soon .",{},set(),"[0, 0, 0, 0, 0, 0, 0, 0, 0, 0, 0, 0, 0, 0, 0, 0, 0, 0, 0, 0, 0, 0, 0, 0, 0, 0, 0, 0, 0, 0, 0]"
14,i love photography .,{},set(),"[0, 0, 0, 0, 0, 0, 0, 0, 0, 0, 0, 0, 0, 0, 0, 0, 0, 0, 0, 0, 0, 0, 0, 0, 0, 0, 0, 0, 0, 0, 0]"
15,i had an older camera that was simply a point and shoot camera .,{},set(),"[0, 0, 0, 0, 0, 0, 0, 0, 0, 0, 0, 0, 0, 0, 0, 0, 0, 0, 0, 0, 0, 0, 0, 0, 0, 0, 0, 0, 0, 0, 0]"
16,"i needed something with more power , so i bought a nikon coolpix 4300 .",{},set(),"[0, 0, 0, 0, 0, 0, 0, 0, 0, 0, 0, 0, 0, 0, 0, 0, 0, 0, 0, 0, 0, 0, 0, 0, 0, 0, 0, 0, 0, 0, 0]"
17,"i fell in love with this camera , it combines ease of use , with an immense amount of options and power .","{'camera': 'positive', 'use': 'positive'}","{('camera', 'positive')}","[0, 0, 0, 0, 0, 0, 0, 0, 0, 0, 0, 1, 0, 0, 0, 0, 0, 0, 0, 0, 0, 0, 0, 0, 0, 0, 0, 0, 0, 0, 0]"
18,"you can use the scene modes , or fine tune the options , i. you can change the iso level , shutter speed , etc.",{},set(),"[0, 0, 0, 0, 0, 0, 0, 0, 0, 0, 0, 0, 0, 0, 0, 0, 0, 0, 0, 0, 0, 0, 0, 0, 0, 0, 0, 0, 0, 0, 0]"
19,"this camera is ideal for people who want more power , but do n't want to spend 1000s dollars on a camera .",{'camera': 'positive'},"{('camera', 'positive')}","[0, 1, 0, 0, 0, 0, 0, 0, 0, 0, 0, 0, 0, 0, 0, 0, 0, 0, 0, 0, 0, 0, 0, 0, 0, 0, 0, 0, 0, 0, 0]"
20,i bought coolpix 4300 two months after i had bought canon powershot s400 .,{},set(),"[0, 0, 0, 0, 0, 0, 0, 0, 0, 0, 0, 0, 0, 0, 0, 0, 0, 0, 0, 0, 0, 0, 0, 0, 0, 0, 0, 0, 0, 0, 0]"
21,reason for two ?,{},set(),"[0, 0, 0, 0, 0, 0, 0, 0, 0, 0, 0, 0, 0, 0, 0, 0, 0, 0, 0, 0, 0, 0, 0, 0, 0, 0, 0, 0, 0, 0, 0]"
22,it was not easy sharing one with my teen age kid .,{},set(),"[0, 0, 0, 0, 0, 0, 0, 0, 0, 0, 0, 0, 0, 0, 0, 0, 0, 0, 0, 0, 0, 0, 0, 0, 0, 0, 0, 0, 0, 0, 0]"
23,the two cameras are very similar in functionality and pricing .,{},set(),"[0, 0, 0, 0, 0, 0, 0, 0, 0, 0, 0, 0, 0, 0, 0, 0, 0, 0, 0, 0, 0, 0, 0, 0, 0, 0, 0, 0, 0, 0, 0]"
24,i 've had no problem with canon whatsoever .,{},set(),"[0, 0, 0, 0, 0, 0, 0, 0, 0, 0, 0, 0, 0, 0, 0, 0, 0, 0, 0, 0, 0, 0, 0, 0, 0, 0, 0, 0, 0, 0, 0]"
25,"with nikon , although picture qualities are as good as any other 4 mp cameras , i 've had the following headaches ;",{'picture quality': 'positive'},set(),"[0, 0, 0, 0, 0, 0, 0, 0, 0, 0, 0, 0, 0, 0, 0, 0, 0, 0, 0, 0, 0, 0, 0, 0, 0, 0, 0, 0, 0, 0, 0]"
26,1 . pictures wo n't transfer to pc directly from the camera using the included transfer cable .,{'transfer': 'negative'},set(),"[0, 0, 0, 0, 0, 0, 0, 0, 0, 0, 0, 0, 0, 0, 0, 0, 0, 0, 0, 0, 0, 0, 0, 0, 0, 0, 0, 0, 0, 0, 0]"
27,"i did everything i could , and it took many days of frustration before concluding that the only way to transfer to pc is with the card reader .",{},set(),"[0, 0, 0, 0, 0, 0, 0, 0, 0, 0, 0, 0, 0, 0, 0, 0, 0, 0, 0, 0, 0, 0, 0, 0, 0, 0, 0, 0, 0, 0, 0]"
28,card reader is included .,{},set(),"[0, 0, 0, 0, 0, 0, 0, 0, 0, 0, 0, 0, 0, 0, 0, 0, 0, 0, 0, 0, 0, 0, 0, 0, 0, 0, 0, 0, 0, 0, 0]"
29,"2 . the speed is noticeably slower than canon , especially so with flashes on .",{},set(),"[0, 0, 0, 0, 0, 0, 0, 0, 0, 0, 0, 0, 0, 0, 0, 0, 0, 0, 0, 0, 0, 0, 0, 0, 0, 0, 0, 0, 0, 0, 0]"
30,"3 . with low battery , it twice wiped out the entire pictures in the memory chip .",{},set(),"[0, 0, 0, 0, 0, 0, 0, 0, 0, 0, 0, 0, 0, 0, 0, 0, 0, 0, 0, 0, 0, 0, 0, 0, 0, 0, 0, 0, 0, 0, 0]"
31,i used lexar 256 mb and i still use it which means nothing is wrong with lexar .,{},set(),"[0, 0, 0, 0, 0, 0, 0, 0, 0, 0, 0, 0, 0, 0, 0, 0, 0, 0, 0, 0, 0, 0, 0, 0, 0, 0, 0, 0, 0, 0, 0]"
32,be very careful when the battery is low and make sure to carry extra batteries .,{},set(),"[0, 0, 0, 0, 0, 0, 0, 0, 0, 0, 0, 0, 0, 0, 0, 0, 0, 0, 0, 0, 0, 0, 0, 0, 0, 0, 0, 0, 0, 0, 0]"
33,"the other reviewers have clearly pointed all the good things about this camera , which i do agree .",{},set(),"[0, 0, 0, 0, 0, 0, 0, 0, 0, 0, 0, 0, 0, 0, 0, 0, 0, 0, 0, 0, 0, 0, 0, 0, 0, 0, 0, 0, 0, 0, 0]"
34,"but there are certain issues might be they are to me here - all of them are minor; not major ones though ,",{},set(),"[0, 0, 0, 0, 0, 0, 0, 0, 0, 0, 0, 0, 0, 0, 0, 0, 0, 0, 0, 0, 0, 0, 0, 0, 0, 0, 0, 0, 0, 0, 0]"
35,. this camera keeps on autofocussing in auto mode with a buzzing sound which can 't be stopped .,{'auto mode': 'negative'},set(),"[0, 0, 0, 0, 0, 0, 0, 0, 0, 0, 0, 0, 0, 0, 0, 0, 0, 0, 0, 0, 0, 0, 0, 0, 0, 0, 0, 0, 0, 0, 0]"
36,would be really good if they have given an option to stop this autofocussing .,{},set(),"[0, 0, 0, 0, 0, 0, 0, 0, 0, 0, 0, 0, 0, 0, 0, 0, 0, 0, 0, 0, 0, 0, 0, 0, 0, 0, 0, 0, 0, 0, 0]"
37,". if you want to have the date ; time on the image , its only through their software "" nikon view "" which reads the images date ; time from the images meta-data .",{},set(),"[0, 0, 0, 0, 0, 0, 0, 0, 0, 0, 0, 0, 0, 0, 0, 0, 0, 0, 0, 0, 0, 0, 0, 0, 0, 0, 0, 0, 0, 0, 0]"
38,so if you use your card reader ; copy images - you got to onceagain open them through their software to put the date ; time .,{},set(),"[0, 0, 0, 0, 0, 0, 0, 0, 0, 0, 0, 0, 0, 0, 0, 0, 0, 0, 0, 0, 0, 0, 0, 0, 0, 0, 0, 0, 0, 0, 0]"
39,"in that too , there is n't a direct way to add date ; time - you got to say ' print images ' to a different directory in which there is an option to specify the date ; time .",{},set(),"[0, 0, 0, 0, 0, 0, 0, 0, 0, 0, 0, 0, 0, 0, 0, 0, 0, 0, 0, 0, 0, 0, 0, 0, 0, 0, 0, 0, 0, 0, 0]"
40,. even the slightest of the shakes totally distorts your image,{'image': 'negative'},set(),"[0, 0, 0, 0, 0, 0, 0, 0, 0, 0, 0, 0, 0, 0, 0, 0, 0, 0, 0, 0, 0, 0, 0, 0, 0, 0, 0, 0, 0, 0, 0]"
41,. images taken indoor were n't so clear .,{'indoor image': 'negative'},set(),"[0, 0, 0, 0, 0, 0, 0, 0, 0, 0, 0, 0, 0, 0, 0, 0, 0, 0, 0, 0, 0, 0, 0, 0, 0, 0, 0, 0, 0, 0, 0]"
42,you got to have flash ' on ' to get it eventhough your room is well lit,{},set(),"[0, 0, 0, 0, 0, 0, 0, 0, 0, 0, 0, 0, 0, 0, 0, 0, 0, 0, 0, 0, 0, 0, 0, 0, 0, 0, 0, 0, 0, 0, 0]"
43,. lens cap is a really annoying,{'lens cap': 'negative'},set(),"[0, 0, 0, 0, 0, 0, 0, 0, 0, 0, 0, 0, 0, 0, 0, 0, 0, 0, 0, 0, 0, 0, 0, 0, 0, 0, 0, 0, 0, 0, 0]"
44,. go ; get a high speed like lexar 12x or higher cf card .,{},set(),"[0, 0, 0, 0, 0, 0, 0, 0, 0, 0, 0, 0, 0, 0, 0, 0, 0, 0, 0, 0, 0, 0, 0, 0, 0, 0, 0, 0, 0, 0, 0]"
45,"else with simpler viking cf cards , it takes couple of seconds to write a picture with approximately "" fine **"" picture quality  "" image size : 1600 .",{},set(),"[0, 0, 0, 0, 0, 0, 0, 0, 0, 0, 0, 0, 0, 0, 0, 0, 0, 0, 0, 0, 0, 0, 0, 0, 0, 0, 0, 0, 0, 0, 0]"
46,. the movie clips taken will always have some ' noise ' in it - you can 't avoid that .,{'movie': 'negative'},set(),"[0, 0, 0, 0, 0, 0, 0, 0, 0, 0, 0, 0, 0, 0, 0, 0, 0, 0, 0, 0, 0, 0, 0, 0, 0, 0, 0, 0, 0, 0, 0]"
47,but overall this is a good camera with a ' really good ' picture clarity ; an exceptional close-up shooting capability .,"{'picture': 'positive', 'closeup shooting': 'positive', 'camera': 'positive'}","{('camera', 'positive'), ('close-up shooting capability', 'positive')}","[0, 0, 0, 1, 0, 0, 0, 0, 0, 0, 0, 0, 0, 0, 0, 0, 0, 0, 0, 0, 0, 0, 0, 0, 0, 0, 0, 0, 0, 0, 0]"
48,i would rate this is 4.5 stars picture quality ; image size defined above are specific to nikon coolpix .,{},set(),"[0, 0, 0, 0, 0, 0, 0, 0, 0, 0, 0, 0, 0, 0, 0, 0, 0, 0, 0, 0, 0, 0, 0, 0, 0, 0, 0, 0, 0, 0, 0]"
49,"within a year , there are problems with my menu dial knob .",{'menu dial knob': 'negative'},set(),"[0, 0, 0, 0, 0, 0, 0, 0, 0, 0, 0, 0, 0, 0, 0, 0, 0, 0, 0, 0, 0, 0, 0, 0, 0, 0, 0, 0, 0, 0, 0]"
50,it became stucked which makes it almost impossible to switch between modes .,{},set(),"[0, 0, 0, 0, 0, 0, 0, 0, 0, 0, 0, 0, 0, 0, 0, 0, 0, 0, 0, 0, 0, 0, 0, 0, 0, 0, 0, 0, 0, 0, 0]"
51,"i send my camera to nikon for servicing , took them a whole 6 weeks to diagnose the problem .",{'servicing': 'negative'},set(),"[0, 0, 0, 0, 0, 0, 0, 0, 0, 0, 0, 0, 0, 0, 0, 0, 0, 0, 0, 0, 0, 0, 0, 0, 0, 0, 0, 0, 0, 0, 0]"
52,"worse of all , they claim that it 's some kind of internal damage and refuse to cover the cost via warranty !",{},set(),"[0, 0, 0, 0, 0, 0, 0, 0, 0, 0, 0, 0, 0, 0, 0, 0, 0, 0, 0, 0, 0, 0, 0, 0, 0, 0, 0, 0, 0, 0, 0]"
53,they would n't repair my camera unless if i pay $ 100 for parts ? and labor !,{},set(),"[0, 0, 0, 0, 0, 0, 0, 0, 0, 0, 0, 0, 0, 0, 0, 0, 0, 0, 0, 0, 0, 0, 0, 0, 0, 0, 0, 0, 0, 0, 0]"
54,"it is a good camera in terms of the function and quality , but take your chance with it because nikon absolutely sucks when it comes to customer service .","{'customer service': 'negative', 'camera': 'positive'}","{('camera', 'positive')}","[0, 0, 0, 1, 0, 0, 0, 0, 0, 0, 0, 0, 0, 0, 0, 0, 0, 0, 0, 0, 0, 0, 0, 0, 0, 0, 0, 0, 0, 0, 0]"
55,"got a "" system error "" problem 30 days after purchase .",{'system error': 'negative'},set(),"[0, 0, 0, 0, 0, 0, 0, 0, 0, 0, 0, 0, 0, 0, 0, 0, 0, 0, 0, 0, 0, 0, 0, 0, 0, 0, 0, 0, 0, 0, 0]"
56,made the camera totally inoperable .,{'camera': 'negative'},"{('camera', 'negative')}","[0, 1, 0, 0, 0, 0, 0, 0, 0, 0, 0, 0, 0, 0, 0, 0, 0, 0, 0, 0, 0, 0, 0, 0, 0, 0, 0, 0, 0, 0, 0]"
57,"also , the lens cap design is flawed .",{'lens cap': 'negative'},set(),"[0, 0, 0, 0, 0, 0, 0, 0, 0, 0, 0, 0, 0, 0, 0, 0, 0, 0, 0, 0, 0, 0, 0, 0, 0, 0, 0, 0, 0, 0, 0]"
58,you have to manually take the cap off in order to use it .,{},set(),"[0, 0, 0, 0, 0, 0, 0, 0, 0, 0, 0, 0, 0, 0, 0, 0, 0, 0, 0, 0, 0, 0, 0, 0, 0, 0, 0, 0, 0, 0, 0]"
59,audio on video also lacking .,{'audio': 'negative'},set(),"[0, 0, 0, 0, 0, 0, 0, 0, 0, 0, 0, 0, 0, 0, 0, 0, 0, 0, 0, 0, 0, 0, 0, 0, 0, 0, 0, 0, 0, 0, 0]"
60,"otherwise , it takes very good pictures ; shutter delay is n't so bad either .","{'picture': 'positive', 'delay': 'positive'}",set(),"[0, 0, 0, 0, 0, 0, 0, 0, 0, 0, 0, 0, 0, 0, 0, 0, 0, 0, 0, 0, 0, 0, 0, 0, 0, 0, 0, 0, 0, 0, 0]"
61,"still , had to send it back to nikon for repair .",{},set(),"[0, 0, 0, 0, 0, 0, 0, 0, 0, 0, 0, 0, 0, 0, 0, 0, 0, 0, 0, 0, 0, 0, 0, 0, 0, 0, 0, 0, 0, 0, 0]"
62,i am an amateur photographer and here is a piece of advise to all the folks who are thinking about making a move the digital world .,{},set(),"[0, 0, 0, 0, 0, 0, 0, 0, 0, 0, 0, 0, 0, 0, 0, 0, 0, 0, 0, 0, 0, 0, 0, 0, 0, 0, 0, 0, 0, 0, 0]"
63,"nikon 4300 , i feel , is the best camera out there for the features and price .",{'camera': 'positive'},"{('camera', 'positive')}","[0, 0, 0, 1, 0, 0, 0, 0, 0, 0, 0, 0, 0, 0, 0, 0, 0, 0, 0, 0, 0, 0, 0, 0, 0, 0, 0, 0, 0, 0, 0]"
64,here were my requirements in a digital camera :,{},set(),"[0, 0, 0, 0, 0, 0, 0, 0, 0, 0, 0, 0, 0, 0, 0, 0, 0, 0, 0, 0, 0, 0, 0, 0, 0, 0, 0, 0, 0, 0, 0]"
65,"1 . i had initially thought of buying a 2 or 3 megapixel camera but these are good for 4x6 "" or 5x7 "" prints and i wanted some really great 8x10 "" photos once in a while .",{},set(),"[0, 0, 0, 0, 0, 0, 0, 0, 0, 0, 0, 0, 0, 0, 0, 0, 0, 0, 0, 0, 0, 0, 0, 0, 0, 0, 0, 0, 0, 0, 0]"
66,2 . i did not want a very small camera as it seems to get lost in my hands and i was n't comfortable with that .,{},set(),"[0, 0, 0, 0, 0, 0, 0, 0, 0, 0, 0, 0, 0, 0, 0, 0, 0, 0, 0, 0, 0, 0, 0, 0, 0, 0, 0, 0, 0, 0, 0]"
67,i wanted a decent sized camera with a contour for my fingers to hold it steadily .,{},set(),"[0, 0, 0, 0, 0, 0, 0, 0, 0, 0, 0, 0, 0, 0, 0, 0, 0, 0, 0, 0, 0, 0, 0, 0, 0, 0, 0, 0, 0, 0, 0]"
68,"3 . i wanted a camera that had a lot of built-in settings for different types of suroundings while giving me an option to use my photography skills although , i am an amateur with an interest in photography by turning on the manual settings .",{},set(),"[0, 0, 0, 0, 0, 0, 0, 0, 0, 0, 0, 0, 0, 0, 0, 0, 0, 0, 0, 0, 0, 0, 0, 0, 0, 0, 0, 0, 0, 0, 0]"
69,"4 . and , of course , i wanted a respected brand and had to stay within my budget because i had bought an expensive camcorder before but had n't used it much .",{},set(),"[0, 0, 0, 0, 0, 0, 0, 0, 0, 0, 0, 0, 0, 0, 0, 0, 0, 0, 0, 0, 0, 0, 0, 0, 0, 0, 0, 0, 0, 0, 0]"
70,"depending on all the above requirements , i had narrowed down my search to nikon 4300 and canon powershot s400 models .",{},set(),"[0, 0, 0, 0, 0, 0, 0, 0, 0, 0, 0, 0, 0, 0, 0, 0, 0, 0, 0, 0, 0, 0, 0, 0, 0, 0, 0, 0, 0, 0, 0]"
71,"nikon got the final nod for its settings auto and manual along with movie modes , medium; compact size , price , brand name , good software that is included and previous reviews .",{},set(),"[0, 0, 0, 0, 0, 0, 0, 0, 0, 0, 0, 0, 0, 0, 0, 0, 0, 0, 0, 0, 0, 0, 0, 0, 0, 0, 0, 0, 0, 0, 0]"
72,i should say i have been very happy with my decision ever since .,{},set(),"[0, 0, 0, 0, 0, 0, 0, 0, 0, 0, 0, 0, 0, 0, 0, 0, 0, 0, 0, 0, 0, 0, 0, 0, 0, 0, 0, 0, 0, 0, 0]"
73,the pictures are absolutely amazing - the camera captures the minutest of details .,{'picture': 'positive'},set(),"[0, 0, 0, 0, 0, 0, 0, 0, 0, 0, 0, 0, 0, 0, 0, 0, 0, 0, 0, 0, 0, 0, 0, 0, 0, 0, 0, 0, 0, 0, 0]"
74,a few things that might make it even better :,{},set(),"[0, 0, 0, 0, 0, 0, 0, 0, 0, 0, 0, 0, 0, 0, 0, 0, 0, 0, 0, 0, 0, 0, 0, 0, 0, 0, 0, 0, 0, 0, 0]"
75,1 . pictures taken in an indoor setting are a little dull and rarely hazy if you tend to take photographs from a distance .,{'indoor picture': 'negative'},set(),"[0, 0, 0, 0, 0, 0, 0, 0, 0, 0, 0, 0, 0, 0, 0, 0, 0, 0, 0, 0, 0, 0, 0, 0, 0, 0, 0, 0, 0, 0, 0]"
76,3 . the pictures come out hazy if your hands shake even for a moment during the entire process of taking a picture .,{'picture': 'negative'},set(),"[0, 0, 0, 0, 0, 0, 0, 0, 0, 0, 0, 0, 0, 0, 0, 0, 0, 0, 0, 0, 0, 0, 0, 0, 0, 0, 0, 0, 0, 0, 0]"
77,"all the above , i think , are problems with all the digital cameras out there and so i have no major complaints .",{},set(),"[0, 0, 0, 0, 0, 0, 0, 0, 0, 0, 0, 0, 0, 0, 0, 0, 0, 0, 0, 0, 0, 0, 0, 0, 0, 0, 0, 0, 0, 0, 0]"
78,try to buy a tripod and that should solve some of those problems .,{},set(),"[0, 0, 0, 0, 0, 0, 0, 0, 0, 0, 0, 0, 0, 0, 0, 0, 0, 0, 0, 0, 0, 0, 0, 0, 0, 0, 0, 0, 0, 0, 0]"
79,"whichever camera you buy , add upto about 200 dollars for an additional memory card i bought a 256 mb card , usb card reader , camera bag and the warranty .",{},set(),"[0, 0, 0, 0, 0, 0, 0, 0, 0, 0, 0, 0, 0, 0, 0, 0, 0, 0, 0, 0, 0, 0, 0, 0, 0, 0, 0, 0, 0, 0, 0]"
80,"and finally , get your pictures developed at a kodak picture maker machine even though it costs you a little extra - no one can beat kodak processing in terms of clarity and brightness .",{},set(),"[0, 0, 0, 0, 0, 0, 0, 0, 0, 0, 0, 0, 0, 0, 0, 0, 0, 0, 0, 0, 0, 0, 0, 0, 0, 0, 0, 0, 0, 0, 0]"
81,hope this review has helped you in making up your mind .,{},set(),"[0, 0, 0, 0, 0, 0, 0, 0, 0, 0, 0, 0, 0, 0, 0, 0, 0, 0, 0, 0, 0, 0, 0, 0, 0, 0, 0, 0, 0, 0, 0]"
82,i have taken about 150 photographs so far and have absolutely loved the experience .,{},set(),"[0, 0, 0, 0, 0, 0, 0, 0, 0, 0, 0, 0, 0, 0, 0, 0, 0, 0, 0, 0, 0, 0, 0, 0, 0, 0, 0, 0, 0, 0, 0]"
83,i am looking forward to my vegas trip for some great photographs now .,{},set(),"[0, 0, 0, 0, 0, 0, 0, 0, 0, 0, 0, 0, 0, 0, 0, 0, 0, 0, 0, 0, 0, 0, 0, 0, 0, 0, 0, 0, 0, 0, 0]"
84,"with our compact 35mm broken , and a vacation in europe at hand , i finally decided to enter the digital age .",{},set(),"[0, 0, 0, 0, 0, 0, 0, 0, 0, 0, 0, 0, 0, 0, 0, 0, 0, 0, 0, 0, 0, 0, 0, 0, 0, 0, 0, 0, 0, 0, 0]"
85,"i first intended to buy the 3100 , but am really happy to invest the extra money for the 4300 .",{},set(),"[0, 0, 0, 0, 0, 0, 0, 0, 0, 0, 0, 0, 0, 0, 0, 0, 0, 0, 0, 0, 0, 0, 0, 0, 0, 0, 0, 0, 0, 0, 0]"
86,"the lense is a lot better , and the 4mb produce fantastic pictures .",{},set(),"[0, 0, 0, 0, 0, 0, 0, 0, 0, 0, 0, 0, 0, 0, 0, 0, 0, 0, 0, 0, 0, 0, 0, 0, 0, 0, 0, 0, 0, 0, 0]"
87,"the possibilities with auto , manual , and the very helpful "" scene "" mode , which offers 11 optimized situational settings like portrait , landscape , beach / snow , sunset etc. , are endless .","{'manual mode': 'positive', 'scene mode': 'positive', 'auto mode': 'positive'}",set(),"[0, 0, 0, 0, 0, 0, 0, 0, 0, 0, 0, 0, 0, 0, 0, 0, 0, 0, 0, 0, 0, 0, 0, 0, 0, 0, 0, 0, 0, 0, 0]"
88,the movie mode is also working great .,{'movie mode': 'positive'},"{('movie mode', 'positive')}","[0, 1, 0, 0, 0, 0, 0, 0, 0, 0, 0, 0, 0, 0, 0, 0, 0, 0, 0, 0, 0, 0, 0, 0, 0, 0, 0, 0, 0, 0, 0]"
89,"the 4300 comes with excellent easy to install software i use it on xp and win98 without problem , battery charger , usb and video cable .",{'software': 'positive'},"{('software', 'positive')}","[0, 0, 0, 0, 0, 0, 0, 0, 0, 0, 0, 0, 0, 0, 0, 0, 0, 0, 0, 0, 0, 0, 0, 0, 0, 0, 0, 0, 1, 0, 0]"
90,"a 64mb flash card camera comes with a 16mb holds 52 pictures on "" normal "" resolution .",{},set(),"[0, 0, 0, 0, 0, 0, 0, 0, 0, 0, 0, 0, 0, 0, 0, 0, 0, 0, 0, 0, 0, 0, 0, 0, 0, 0, 0, 0, 0, 0, 0]"
91,"i experimented with online print ordering with the two major us brick and mortar retailers , and they both delivered great results .",{'print': 'positive'},"{('print', 'positive'), ('results', 'positive')}","[0, 0, 0, 1, 0, 0, 0, 0, 0, 0, 0, 0, 0, 0, 0, 0, 0, 0, 0, 0, 0, 0, 0, 0, 0, 0, 0, 0, 0, 0, 0]"
92,"even at the "" normal "" setting , a 8x10 print ! shows not a single sign of visible rendering or pixels - you could never tell that the picture has been taken by a "" digital "" .",{'print': 'positive'},set(),"[0, 0, 0, 0, 0, 0, 0, 0, 0, 0, 0, 0, 0, 0, 0, 0, 0, 0, 0, 0, 0, 0, 0, 0, 0, 0, 0, 0, 0, 0, 0]"
93,"the battery life is ok , but can be somewhat short when working a lot with the monitor on .",{'battery life': 'positive'},"{('battery life', 'positive')}","[0, 1, 0, 0, 0, 0, 0, 0, 0, 0, 0, 0, 0, 0, 0, 0, 0, 0, 0, 0, 0, 0, 0, 0, 0, 0, 0, 0, 0, 0, 0]"
94,"i therefore bought a second battery as a backup , and due to the lightingfast charging with the included charger , which by the way works on 110v as well as 220v in europe , we ran never out of "" juice "" .",{},set(),"[0, 0, 0, 0, 0, 0, 0, 0, 0, 0, 0, 0, 0, 0, 0, 0, 0, 0, 0, 0, 0, 0, 0, 0, 0, 0, 0, 0, 0, 0, 0]"
95,"i highly recommend the accessory kit , which provides you with everything else you need :",{},set(),"[0, 0, 0, 0, 0, 0, 0, 0, 0, 0, 0, 0, 0, 0, 0, 0, 0, 0, 0, 0, 0, 0, 0, 0, 0, 0, 0, 0, 0, 0, 0]"
96,"a nice camera bag , which holds camera plus all the cables and the charger .",{},set(),"[0, 0, 0, 0, 0, 0, 0, 0, 0, 0, 0, 0, 0, 0, 0, 0, 0, 0, 0, 0, 0, 0, 0, 0, 0, 0, 0, 0, 0, 0, 0]"
97,"furher it contains a card reader , a flash card folder for up to 8 cards , a lense cleaning rag , and an ac adapter , which is very helpful when working in an "" outlet environment "" .",{},set(),"[0, 0, 0, 0, 0, 0, 0, 0, 0, 0, 0, 0, 0, 0, 0, 0, 0, 0, 0, 0, 0, 0, 0, 0, 0, 0, 0, 0, 0, 0, 0]"
98,"over all a fantastic very compact camera , which made us experience photography on a totally new level !",{'camera': 'positive'},"{('camera', 'positive'), ('level', 'positive')}","[0, 0, 0, 1, 0, 0, 0, 0, 0, 0, 0, 0, 0, 0, 0, 0, 0, 0, 0, 0, 0, 0, 0, 0, 0, 0, 0, 0, 0, 0, 0]"
99,"after reading all the glowing review on this camera , i went to my local camera shop to try one .",{},set(),"[0, 0, 0, 0, 0, 0, 0, 0, 0, 0, 0, 0, 0, 0, 0, 0, 0, 0, 0, 0, 0, 0, 0, 0, 0, 0, 0, 0, 0, 0, 0]"
100,i currently own an olympus d-550 which takes wonderful outdoor pictures .,{},set(),"[0, 0, 0, 0, 0, 0, 0, 0, 0, 0, 0, 0, 0, 0, 0, 0, 0, 0, 0, 0, 0, 0, 0, 0, 0, 0, 0, 0, 0, 0, 0]"
101,"however , indoor pictures of subjects more than a few feet away can be blurry or grainy .",{},set(),"[0, 0, 0, 0, 0, 0, 0, 0, 0, 0, 0, 0, 0, 0, 0, 0, 0, 0, 0, 0, 0, 0, 0, 0, 0, 0, 0, 0, 0, 0, 0]"
102,"anyway , in the store , i tried coolpix 4300 along with two other 4mp models minolta dimage s414 , and panasonic lumix .",{},set(),"[0, 0, 0, 0, 0, 0, 0, 0, 0, 0, 0, 0, 0, 0, 0, 0, 0, 0, 0, 0, 0, 0, 0, 0, 0, 0, 0, 0, 0, 0, 0]"
103,"focusing on a display rack about 20 feet away in a brightly lit room during day time , pictures produced by this camera were blurry and in a shade of orange .",{'picture': 'negative'},set(),"[0, 0, 0, 0, 0, 0, 0, 0, 0, 0, 0, 0, 0, 0, 0, 0, 0, 0, 0, 0, 0, 0, 0, 0, 0, 0, 0, 0, 0, 0, 0]"
104,pictures produced by the minolta were orange but not blurry .,{},set(),"[0, 0, 0, 0, 0, 0, 0, 0, 0, 0, 0, 0, 0, 0, 0, 0, 0, 0, 0, 0, 0, 0, 0, 0, 0, 0, 0, 0, 0, 0, 0]"
105,pictures produced by the panasonic were excellent .,{},set(),"[0, 0, 0, 0, 0, 0, 0, 0, 0, 0, 0, 0, 0, 0, 0, 0, 0, 0, 0, 0, 0, 0, 0, 0, 0, 0, 0, 0, 0, 0, 0]"
106,"the store clerk concluded that the blurriness may be caused by shaking the camera slightly when i press the button , which is understandable since this camera is lighter than the other two models .",{},set(),"[0, 0, 0, 0, 0, 0, 0, 0, 0, 0, 0, 0, 0, 0, 0, 0, 0, 0, 0, 0, 0, 0, 0, 0, 0, 0, 0, 0, 0, 0, 0]"
107,"anyway , i ended up purchasing the lumix .",{},set(),"[0, 0, 0, 0, 0, 0, 0, 0, 0, 0, 0, 0, 0, 0, 0, 0, 0, 0, 0, 0, 0, 0, 0, 0, 0, 0, 0, 0, 0, 0, 0]"
108,i 'm sure that this camera has all the wonderful features that others talk about .,{},set(),"[0, 0, 0, 0, 0, 0, 0, 0, 0, 0, 0, 0, 0, 0, 0, 0, 0, 0, 0, 0, 0, 0, 0, 0, 0, 0, 0, 0, 0, 0, 0]"
109,"however , as an average person with unsteady hands , i doubt it 'll perform well in lower light settings .",{},set(),"[0, 0, 0, 0, 0, 0, 0, 0, 0, 0, 0, 0, 0, 0, 0, 0, 0, 0, 0, 0, 0, 0, 0, 0, 0, 0, 0, 0, 0, 0, 0]"
110,i purchased the nikon 4300 after several weeks of searching .,{},set(),"[0, 0, 0, 0, 0, 0, 0, 0, 0, 0, 0, 0, 0, 0, 0, 0, 0, 0, 0, 0, 0, 0, 0, 0, 0, 0, 0, 0, 0, 0, 0]"
111,"the value , name , and resolution signed the lease .",{},set(),"[0, 0, 0, 0, 0, 0, 0, 0, 0, 0, 0, 0, 0, 0, 0, 0, 0, 0, 0, 0, 0, 0, 0, 0, 0, 0, 0, 0, 0, 0, 0]"
112,after nearly 800 pictures i have found that this nikon takes incredible pictures .,{'picture': 'positive'},set(),"[0, 0, 0, 0, 0, 0, 0, 0, 0, 0, 0, 0, 0, 0, 0, 0, 0, 0, 0, 0, 0, 0, 0, 0, 0, 0, 0, 0, 0, 0, 0]"
113,"the digital zoom takes as good of pictures , as the optical zoom does !","{'digital zoom': 'positive', 'optical zoom': 'positive'}","{('digital zoom', 'positive'), ('optical zoom', 'positive')}","[0, 1, 0, 0, 0, 0, 0, 0, 0, 0, 0, 0, 0, 0, 0, 0, 0, 0, 0, 0, 0, 0, 0, 0, 0, 0, 0, 0, 0, 0, 0]"
114,"the inside pics , can be a bit challenging , but when you can instantly delete pics you dont like , that are not focused perfectly , or need lighting adjustments , make this camera very simple and effective .",{'picture': 'negative'},set(),"[0, 0, 0, 0, 0, 0, 0, 0, 0, 0, 0, 0, 0, 0, 0, 0, 0, 0, 0, 0, 0, 0, 0, 0, 0, 0, 0, 0, 0, 0, 0]"
